15:13:55.731635 IP 198.96.85.21.62430 > lamp-s-1vcpu-1gb-tor1-01.ssh: Flags [.], ack 3350500, win 2009, options [nop,nop,TS val 1127861339 ecr 1242479523], length 0
15:13:55.731638 IP 198.96.85.21.62430 > lamp-s-1vcpu-1gb-tor1-01.ssh: Flags [.], ack 3350720, win 2006, options [nop,nop,TS val 1127861339 ecr 1242479523], length 0
15:13:55.731676 IP 198.96.85.21.62430 > lamp-s-1vcpu-1gb-tor1-01.ssh: Flags [.], ack 3350940, win 2003, options [nop,nop,TS val 1127861339 ecr 1242479524], length 0
15:13:55.731683 IP 198.96.85.21.62430 > lamp-s-1vcpu-1gb-tor1-01.ssh: Flags [.], ack 3351160, win 1999, options [nop,nop,TS val 1127861339 ecr 1242479524], length 0
15:13:55.731808 IP 198.96.85.21.62430 > lamp-s-1vcpu-1gb-tor1-01.ssh: Flags [.], ack 3351380, win 1996, options [nop,nop,TS val 1127861339 ecr 1242479524], length 0
15:13:55.731821 IP 198.96.85.21.62430 > lamp-s-1vcpu-1gb-tor1-01.ssh: Flags [.], ack 3351600, win 1992, options [nop,nop,TS val 1127861339 ecr 1242479524], length 0
15:13:55.731826 IP 198.96.85.21.62430 > lamp-s-1vcpu-1gb-tor1-01.ssh: Flags [.], ack 3351820, win 1989, options [nop,nop,TS val 1127861339 ecr 1242479524], length 0
15:13:55.731830 IP 198.96.85.21.62430 > lamp-s-1vcpu-1gb-tor1-01.ssh: Flags [.], ack 3352040, win 1985, options [nop,nop,TS val 1127861339 ecr 1242479524], length 0
15:13:55.731834 IP 198.96.85.21.62430 > lamp-s-1vcpu-1gb-tor1-01.ssh: Flags [.], ack 3352260, win 1982, options [nop,nop,TS val 1127861339 ecr 1242479524], length 0
15:13:55.731838 IP 198.96.85.21.62430 > lamp-s-1vcpu-1gb-tor1-01.ssh: Flags [.], ack 3352480, win 1979, options [nop,nop,TS val 1127861339 ecr 1242479524], length 0
15:13:55.731842 IP 198.96.85.21.62430 > lamp-s-1vcpu-1gb-tor1-01.ssh: Flags [.], ack 3352700, win 1975, options [nop,nop,TS val 1127861339 ecr 1242479524], length 0
15:13:55.731962 IP 198.96.85.21.62430 > lamp-s-1vcpu-1gb-tor1-01.ssh: Flags [.], ack 3352920, win 2044, options [nop,nop,TS val 1127861339 ecr 1242479524], length 0
15:13:55.732121 IP lamp-s-1vcpu-1gb-tor1-01.ssh > 198.96.85.21.62430: Flags [P.], seq 3360268:3361632, ack 2125, win 309, options [nop,nop,TS val 1242479527 ecr 1127861339], length 1364
15:13:55.732227 IP lamp-s-1vcpu-1gb-tor1-01.ssh > 198.96.85.21.62430: Flags [P.], seq 3361632:3361860, ack 2125, win 309, options [nop,nop,TS val 1242479527 ecr 1127861339], length 228
15:13:55.732328 IP lamp-s-1vcpu-1gb-tor1-01.ssh > 198.96.85.21.62430: Flags [P.], seq 3361860:3362080, ack 2125, win 309, options [nop,nop,TS val 1242479527 ecr 1127861339], length 220
15:13:55.732428 IP lamp-s-1vcpu-1gb-tor1-01.ssh > 198.96.85.21.62430: Flags [P.], seq 3362080:3362300, ack 2125, win 309, options [nop,nop,TS val 1242479528 ecr 1127861339], length 220
15:13:55.732514 IP lamp-s-1vcpu-1gb-tor1-01.ssh > 198.96.85.21.62430: Flags [P.], seq 3362300:3362520, ack 2125, win 309, options [nop,nop,TS val 1242479528 ecr 1127861339], length 220
15:13:55.732598 IP lamp-s-1vcpu-1gb-tor1-01.ssh > 198.96.85.21.62430: Flags [P.], seq 3362520:3362740, ack 2125, win 309, options [nop,nop,TS val 1242479528 ecr 1127861339], length 220
15:13:55.732681 IP lamp-s-1vcpu-1gb-tor1-01.ssh > 198.96.85.21.62430: Flags [P.], seq 3362740:3362960, ack 2125, win 309, options [nop,nop,TS val 1242479528 ecr 1127861339], length 220
15:13:55.732768 IP lamp-s-1vcpu-1gb-tor1-01.ssh > 198.96.85.21.62430: Flags [P.], seq 3362960:3363180, ack 2125, win 309, options [nop,nop,TS val 1242479528 ecr 1127861339], length 220
15:13:55.732853 IP lamp-s-1vcpu-1gb-tor1-01.ssh > 198.96.85.21.62430: Flags [P.], seq 3363180:3363400, ack 2125, win 309, options [nop,nop,TS val 1242479528 ecr 1127861339], length 220
15:13:55.732937 IP lamp-s-1vcpu-1gb-tor1-01.ssh > 198.96.85.21.62430: Flags [P.], seq 3363400:3363620, ack 2125, win 309, options [nop,nop,TS val 1242479528 ecr 1127861339], length 220
15:13:55.733020 IP lamp-s-1vcpu-1gb-tor1-01.ssh > 198.96.85.21.62430: Flags [P.], seq 3363620:3363840, ack 2125, win 309, options [nop,nop,TS val 1242479528 ecr 1127861339], length 220
15:13:55.733104 IP lamp-s-1vcpu-1gb-tor1-01.ssh > 198.96.85.21.62430: Flags [P.], seq 3363840:3364060, ack 2125, win 309, options [nop,nop,TS val 1242479528 ecr 1127861339], length 220
15:13:55.733205 IP lamp-s-1vcpu-1gb-tor1-01.ssh > 198.96.85.21.62430: Flags [P.], seq 3364060:3364280, ack 2125, win 309, options [nop,nop,TS val 1242479528 ecr 1127861339], length 220
15:13:55.733289 IP lamp-s-1vcpu-1gb-tor1-01.ssh > 198.96.85.21.62430: Flags [P.], seq 3364280:3364500, ack 2125, win 309, options [nop,nop,TS val 1242479528 ecr 1127861339], length 220
15:13:55.733372 IP lamp-s-1vcpu-1gb-tor1-01.ssh > 198.96.85.21.62430: Flags [P.], seq 3364500:3364720, ack 2125, win 309, options [nop,nop,TS val 1242479528 ecr 1127861339], length 220
15:13:55.733456 IP lamp-s-1vcpu-1gb-tor1-01.ssh > 198.96.85.21.62430: Flags [P.], seq 3364720:3364940, ack 2125, win 309, options [nop,nop,TS val 1242479529 ecr 1127861339], length 220
15:13:55.733539 IP lamp-s-1vcpu-1gb-tor1-01.ssh > 198.96.85.21.62430: Flags [P.], seq 3364940:3365160, ack 2125, win 309, options [nop,nop,TS val 1242479529 ecr 1127861339], length 220
15:13:55.733642 IP lamp-s-1vcpu-1gb-tor1-01.ssh > 198.96.85.21.62430: Flags [P.], seq 3365160:3365380, ack 2125, win 309, options [nop,nop,TS val 1242479529 ecr 1127861339], length 220
15:13:55.733689 IP 198.96.85.21.62430 > lamp-s-1vcpu-1gb-tor1-01.ssh: Flags [.], ack 3353476, win 2039, options [nop,nop,TS val 1127861340 ecr 1242479524], length 0
15:13:55.733702 IP 198.96.85.21.62430 > lamp-s-1vcpu-1gb-tor1-01.ssh: Flags [.], ack 3353696, win 2035, options [nop,nop,TS val 1127861340 ecr 1242479525], length 0
15:13:55.733800 IP lamp-s-1vcpu-1gb-tor1-01.ssh > 198.96.85.21.62430: Flags [P.], seq 3365380:3365936, ack 2125, win 309, options [nop,nop,TS val 1242479529 ecr 1127861340], length 556
15:13:55.733898 IP lamp-s-1vcpu-1gb-tor1-01.ssh > 198.96.85.21.62430: Flags [P.], seq 3365936:3366156, ack 2125, win 309, options [nop,nop,TS val 1242479529 ecr 1127861340], length 220
15:13:55.733987 IP lamp-s-1vcpu-1gb-tor1-01.ssh > 198.96.85.21.62430: Flags [P.], seq 3366156:3366376, ack 2125, win 309, options [nop,nop,TS val 1242479529 ecr 1127861340], length 220
15:13:55.734071 IP lamp-s-1vcpu-1gb-tor1-01.ssh > 198.96.85.21.62430: Flags [P.], seq 3366376:3366596, ack 2125, win 309, options [nop,nop,TS val 1242479529 ecr 1127861340], length 220
15:13:55.734155 IP lamp-s-1vcpu-1gb-tor1-01.ssh > 198.96.85.21.62430: Flags [P.], seq 3366596:3366816, ack 2125, win 309, options [nop,nop,TS val 1242479529 ecr 1127861340], length 220
15:13:55.734239 IP lamp-s-1vcpu-1gb-tor1-01.ssh > 198.96.85.21.62430: Flags [P.], seq 3366816:3367036, ack 2125, win 309, options [nop,nop,TS val 1242479529 ecr 1127861340], length 220
15:13:55.734326 IP lamp-s-1vcpu-1gb-tor1-01.ssh > 198.96.85.21.62430: Flags [P.], seq 3367036:3367256, ack 2125, win 309, options [nop,nop,TS val 1242479529 ecr 1127861340], length 220
15:13:55.734412 IP lamp-s-1vcpu-1gb-tor1-01.ssh > 198.96.85.21.62430: Flags [P.], seq 3367256:3367476, ack 2125, win 309, options [nop,nop,TS val 1242479530 ecr 1127861340], length 220
15:13:55.734495 IP lamp-s-1vcpu-1gb-tor1-01.ssh > 198.96.85.21.62430: Flags [P.], seq 3367476:3367696, ack 2125, win 309, options [nop,nop,TS val 1242479530 ecr 1127861340], length 220
15:13:55.734618 IP lamp-s-1vcpu-1gb-tor1-01.ssh > 198.96.85.21.62430: Flags [P.], seq 3367696:3367916, ack 2125, win 309, options [nop,nop,TS val 1242479530 ecr 1127861340], length 220
15:13:55.734740 IP lamp-s-1vcpu-1gb-tor1-01.ssh > 198.96.85.21.62430: Flags [P.], seq 3367916:3368136, ack 2125, win 309, options [nop,nop,TS val 1242479530 ecr 1127861340], length 220
15:13:55.734816 IP 198.96.85.21.62430 > lamp-s-1vcpu-1gb-tor1-01.ssh: Flags [.], ack 3353916, win 2032, options [nop,nop,TS val 1127861340 ecr 1242479525], length 0
15:13:55.734830 IP 198.96.85.21.62430 > lamp-s-1vcpu-1gb-tor1-01.ssh: Flags [.], ack 3354136, win 2044, options [nop,nop,TS val 1127861340 ecr 1242479525], length 0
15:13:55.734835 IP 198.96.85.21.62430 > lamp-s-1vcpu-1gb-tor1-01.ssh: Flags [.], ack 3354356, win 2041, options [nop,nop,TS val 1127861340 ecr 1242479525], length 0
15:13:55.734854 IP 198.96.85.21.62430 > lamp-s-1vcpu-1gb-tor1-01.ssh: Flags [.], ack 3354576, win 2037, options [nop,nop,TS val 1127861340 ecr 1242479525], length 0
15:13:55.734862 IP 198.96.85.21.62430 > lamp-s-1vcpu-1gb-tor1-01.ssh: Flags [.], ack 3354796, win 2034, options [nop,nop,TS val 1127861340 ecr 1242479525], length 0
15:13:55.734866 IP 198.96.85.21.62430 > lamp-s-1vcpu-1gb-tor1-01.ssh: Flags [.], ack 3355016, win 2044, options [nop,nop,TS val 1127861340 ecr 1242479525], length 0
15:13:55.734869 IP 198.96.85.21.62430 > lamp-s-1vcpu-1gb-tor1-01.ssh: Flags [.], ack 3355236, win 2041, options [nop,nop,TS val 1127861340 ecr 1242479525], length 0
15:13:55.734946 IP 198.96.85.21.62430 > lamp-s-1vcpu-1gb-tor1-01.ssh: Flags [.], ack 3355456, win 2037, options [nop,nop,TS val 1127861340 ecr 1242479525], length 0
15:13:55.734981 IP 198.96.85.21.62430 > lamp-s-1vcpu-1gb-tor1-01.ssh: Flags [.], ack 3355676, win 2044, options [nop,nop,TS val 1127861340 ecr 1242479526], length 0
15:13:55.734989 IP 198.96.85.21.62430 > lamp-s-1vcpu-1gb-tor1-01.ssh: Flags [.], ack 3357208, win 2024, options [nop,nop,TS val 1127861341 ecr 1242479526], length 0
15:13:55.734993 IP 198.96.85.21.62430 > lamp-s-1vcpu-1gb-tor1-01.ssh: Flags [.], ack 3357620, win 2017, options [nop,nop,TS val 1127861341 ecr 1242479526], length 0
15:13:55.735054 IP 198.96.85.21.62430 > lamp-s-1vcpu-1gb-tor1-01.ssh: Flags [.], ack 3360268, win 2048, options [nop,nop,TS val 1127861341 ecr 1242479527], length 0
15:13:55.735216 IP lamp-s-1vcpu-1gb-tor1-01.ssh > 198.96.85.21.62430: Flags [P.], seq 3368136:3370348, ack 2125, win 309, options [nop,nop,TS val 1242479530 ecr 1127861341], length 2212
15:13:55.735312 IP lamp-s-1vcpu-1gb-tor1-01.ssh > 198.96.85.21.62430: Flags [P.], seq 3370348:3370576, ack 2125, win 309, options [nop,nop,TS val 1242479530 ecr 1127861341], length 228
15:13:55.735400 IP lamp-s-1vcpu-1gb-tor1-01.ssh > 198.96.85.21.62430: Flags [P.], seq 3370576:3370796, ack 2125, win 309, options [nop,nop,TS val 1242479531 ecr 1127861341], length 220
15:13:55.735487 IP lamp-s-1vcpu-1gb-tor1-01.ssh > 198.96.85.21.62430: Flags [P.], seq 3370796:3371016, ack 2125, win 309, options [nop,nop,TS val 1242479531 ecr 1127861341], length 220
15:13:55.735572 IP lamp-s-1vcpu-1gb-tor1-01.ssh > 198.96.85.21.62430: Flags [P.], seq 3371016:3371236, ack 2125, win 309, options [nop,nop,TS val 1242479531 ecr 1127861341], length 220
15:13:55.735656 IP lamp-s-1vcpu-1gb-tor1-01.ssh > 198.96.85.21.62430: Flags [P.], seq 3371236:3371456, ack 2125, win 309, options [nop,nop,TS val 1242479531 ecr 1127861341], length 220
15:13:55.735739 IP lamp-s-1vcpu-1gb-tor1-01.ssh > 198.96.85.21.62430: Flags [P.], seq 3371456:3371676, ack 2125, win 309, options [nop,nop,TS val 1242479531 ecr 1127861341], length 220
15:13:55.735823 IP lamp-s-1vcpu-1gb-tor1-01.ssh > 198.96.85.21.62430: Flags [P.], seq 3371676:3371896, ack 2125, win 309, options [nop,nop,TS val 1242479531 ecr 1127861341], length 220
15:13:55.735907 IP lamp-s-1vcpu-1gb-tor1-01.ssh > 198.96.85.21.62430: Flags [P.], seq 3371896:3372116, ack 2125, win 309, options [nop,nop,TS val 1242479531 ecr 1127861341], length 220
15:13:55.735935 IP 198.96.85.21.62430 > lamp-s-1vcpu-1gb-tor1-01.ssh: Flags [P.], seq 2125:2161, ack 3360268, win 2048, options [nop,nop,TS val 1127861341 ecr 1242479527], length 36
15:13:55.735945 IP 198.96.85.21.62430 > lamp-s-1vcpu-1gb-tor1-01.ssh: Flags [.], ack 3361632, win 2026, options [nop,nop,TS val 1127861341 ecr 1242479527], length 0
15:13:55.735951 IP 198.96.85.21.62430 > lamp-s-1vcpu-1gb-tor1-01.ssh: Flags [.], ack 3361860, win 2023, options [nop,nop,TS val 1127861341 ecr 1242479527], length 0
15:13:55.735955 IP 198.96.85.21.62430 > lamp-s-1vcpu-1gb-tor1-01.ssh: Flags [.], ack 3362080, win 2044, options [nop,nop,TS val 1127861341 ecr 1242479527], length 0
15:13:55.735959 IP 198.96.85.21.62430 > lamp-s-1vcpu-1gb-tor1-01.ssh: Flags [.], ack 3362300, win 2041, options [nop,nop,TS val 1127861341 ecr 1242479528], length 0
15:13:55.735963 IP 198.96.85.21.62430 > lamp-s-1vcpu-1gb-tor1-01.ssh: Flags [.], ack 3362520, win 2037, options [nop,nop,TS val 1127861341 ecr 1242479528], length 0
15:13:55.736057 IP 198.96.85.21.62430 > lamp-s-1vcpu-1gb-tor1-01.ssh: Flags [.], ack 3362740, win 2034, options [nop,nop,TS val 1127861341 ecr 1242479528], length 0
15:13:55.736068 IP 198.96.85.21.62430 > lamp-s-1vcpu-1gb-tor1-01.ssh: Flags [.], ack 3362960, win 2044, options [nop,nop,TS val 1127861342 ecr 1242479528], length 0
15:13:55.736429 IP lamp-s-1vcpu-1gb-tor1-01.ssh > 198.96.85.21.62430: Flags [P.], seq 3372116:3373688, ack 2161, win 309, options [nop,nop,TS val 1242479532 ecr 1127861341], length 1572
15:13:55.736527 IP lamp-s-1vcpu-1gb-tor1-01.ssh > 198.96.85.21.62430: Flags [P.], seq 3373688:3373916, ack 2161, win 309, options [nop,nop,TS val 1242479532 ecr 1127861341], length 228
15:13:55.736615 IP lamp-s-1vcpu-1gb-tor1-01.ssh > 198.96.85.21.62430: Flags [P.], seq 3373916:3374136, ack 2161, win 309, options [nop,nop,TS val 1242479532 ecr 1127861341], length 220
15:13:55.736700 IP lamp-s-1vcpu-1gb-tor1-01.ssh > 198.96.85.21.62430: Flags [P.], seq 3374136:3374356, ack 2161, win 309, options [nop,nop,TS val 1242479532 ecr 1127861341], length 220
15:13:55.736751 IP 198.96.85.21.62430 > lamp-s-1vcpu-1gb-tor1-01.ssh: Flags [.], ack 3364940, win 2044, options [nop,nop,TS val 1127861342 ecr 1242479529], length 0
15:13:55.736764 IP 198.96.85.21.62430 > lamp-s-1vcpu-1gb-tor1-01.ssh: Flags [.], ack 3365160, win 2041, options [nop,nop,TS val 1127861342 ecr 1242479529], length 0
15:13:55.736770 IP 198.96.85.21.62430 > lamp-s-1vcpu-1gb-tor1-01.ssh: Flags [.], ack 3365380, win 2037, options [nop,nop,TS val 1127861342 ecr 1242479529], length 0
15:13:55.736774 IP 198.96.85.21.62430 > lamp-s-1vcpu-1gb-tor1-01.ssh: Flags [.], ack 3365936, win 2039, options [nop,nop,TS val 1127861342 ecr 1242479529], length 0
15:13:55.736803 IP 198.96.85.21.62430 > lamp-s-1vcpu-1gb-tor1-01.ssh: Flags [.], ack 3366156, win 2044, options [nop,nop,TS val 1127861343 ecr 1242479529], length 0
15:13:55.736812 IP 198.96.85.21.62430 > lamp-s-1vcpu-1gb-tor1-01.ssh: Flags [.], ack 3366376, win 2041, options [nop,nop,TS val 1127861343 ecr 1242479529], length 0
15:13:55.736816 IP 198.96.85.21.62430 > lamp-s-1vcpu-1gb-tor1-01.ssh: Flags [.], ack 3366596, win 2037, options [nop,nop,TS val 1127861343 ecr 1242479529], length 0
15:13:55.737028 IP lamp-s-1vcpu-1gb-tor1-01.ssh > 198.96.85.21.62430: Flags [P.], seq 3374356:3375744, ack 2161, win 309, options [nop,nop,TS val 1242479532 ecr 1127861343], length 1388
15:13:55.737128 IP lamp-s-1vcpu-1gb-tor1-01.ssh > 198.96.85.21.62430: Flags [P.], seq 3375744:3375972, ack 2161, win 309, options [nop,nop,TS val 1242479532 ecr 1127861343], length 228
15:13:55.737225 IP lamp-s-1vcpu-1gb-tor1-01.ssh > 198.96.85.21.62430: Flags [P.], seq 3375972:3376192, ack 2161, win 309, options [nop,nop,TS val 1242479532 ecr 1127861343], length 220
15:13:55.737316 IP lamp-s-1vcpu-1gb-tor1-01.ssh > 198.96.85.21.62430: Flags [P.], seq 3376192:3376412, ack 2161, win 309, options [nop,nop,TS val 1242479532 ecr 1127861343], length 220
15:13:55.737401 IP lamp-s-1vcpu-1gb-tor1-01.ssh > 198.96.85.21.62430: Flags [P.], seq 3376412:3376632, ack 2161, win 309, options [nop,nop,TS val 1242479533 ecr 1127861343], length 220
15:13:55.737489 IP lamp-s-1vcpu-1gb-tor1-01.ssh > 198.96.85.21.62430: Flags [P.], seq 3376632:3376852, ack 2161, win 309, options [nop,nop,TS val 1242479533 ecr 1127861343], length 220
15:13:55.737592 IP 198.96.85.21.62430 > lamp-s-1vcpu-1gb-tor1-01.ssh: Flags [.], ack 3367916, win 2044, options [nop,nop,TS val 1127861343 ecr 1242479530], length 0
15:13:55.737606 IP 198.96.85.21.62430 > lamp-s-1vcpu-1gb-tor1-01.ssh: Flags [.], ack 3368136, win 2041, options [nop,nop,TS val 1127861343 ecr 1242479530], length 0
15:13:55.737676 IP lamp-s-1vcpu-1gb-tor1-01.ssh > 198.96.85.21.62430: Flags [P.], seq 3376852:3377072, ack 2161, win 309, options [nop,nop,TS val 1242479533 ecr 1127861343], length 220
15:13:55.737731 IP lamp-s-1vcpu-1gb-tor1-01.ssh > 198.96.85.21.62430: Flags [P.], seq 3377072:3377444, ack 2161, win 309, options [nop,nop,TS val 1242479533 ecr 1127861343], length 372
15:13:55.737833 IP lamp-s-1vcpu-1gb-tor1-01.ssh > 198.96.85.21.62430: Flags [P.], seq 3377444:3377856, ack 2161, win 309, options [nop,nop,TS val 1242479533 ecr 1127861343], length 412
15:13:55.737924 IP lamp-s-1vcpu-1gb-tor1-01.ssh > 198.96.85.21.62430: Flags [P.], seq 3377856:3378076, ack 2161, win 309, options [nop,nop,TS val 1242479533 ecr 1127861343], length 220
15:13:55.738010 IP lamp-s-1vcpu-1gb-tor1-01.ssh > 198.96.85.21.62430: Flags [P.], seq 3378076:3378296, ack 2161, win 309, options [nop,nop,TS val 1242479533 ecr 1127861343], length 220
15:13:55.738099 IP lamp-s-1vcpu-1gb-tor1-01.ssh > 198.96.85.21.62430: Flags [P.], seq 3378296:3378516, ack 2161, win 309, options [nop,nop,TS val 1242479533 ecr 1127861343], length 220
15:13:55.738184 IP lamp-s-1vcpu-1gb-tor1-01.ssh > 198.96.85.21.62430: Flags [P.], seq 3378516:3378736, ack 2161, win 309, options [nop,nop,TS val 1242479533 ecr 1127861343], length 220
15:13:55.738274 IP lamp-s-1vcpu-1gb-tor1-01.ssh > 198.96.85.21.62430: Flags [P.], seq 3378736:3378956, ack 2161, win 309, options [nop,nop,TS val 1242479533 ecr 1127861343], length 220
15:13:55.738359 IP lamp-s-1vcpu-1gb-tor1-01.ssh > 198.96.85.21.62430: Flags [P.], seq 3378956:3379176, ack 2161, win 309, options [nop,nop,TS val 1242479533 ecr 1127861343], length 220
15:13:55.738448 IP lamp-s-1vcpu-1gb-tor1-01.ssh > 198.96.85.21.62430: Flags [P.], seq 3379176:3379396, ack 2161, win 309, options [nop,nop,TS val 1242479534 ecr 1127861343], length 220
15:13:55.738536 IP lamp-s-1vcpu-1gb-tor1-01.ssh > 198.96.85.21.62430: Flags [P.], seq 3379396:3379616, ack 2161, win 309, options [nop,nop,TS val 1242479534 ecr 1127861343], length 220
15:13:55.738627 IP lamp-s-1vcpu-1gb-tor1-01.ssh > 198.96.85.21.62430: Flags [P.], seq 3379616:3379836, ack 2161, win 309, options [nop,nop,TS val 1242479534 ecr 1127861343], length 220
15:13:55.738739 IP lamp-s-1vcpu-1gb-tor1-01.ssh > 198.96.85.21.62430: Flags [P.], seq 3379836:3380056, ack 2161, win 309, options [nop,nop,TS val 1242479534 ecr 1127861343], length 220
15:13:55.738829 IP 198.96.85.21.62430 > lamp-s-1vcpu-1gb-tor1-01.ssh: Flags [.], ack 3370348, win 2013, options [nop,nop,TS val 1127861344 ecr 1242479530], length 0
15:13:55.738845 IP 198.96.85.21.62430 > lamp-s-1vcpu-1gb-tor1-01.ssh: Flags [.], ack 3370576, win 2009, options [nop,nop,TS val 1127861344 ecr 1242479530], length 0
15:13:55.738850 IP 198.96.85.21.62430 > lamp-s-1vcpu-1gb-tor1-01.ssh: Flags [.], ack 3370796, win 2006, options [nop,nop,TS val 1127861344 ecr 1242479531], length 0
15:13:55.738854 IP 198.96.85.21.62430 > lamp-s-1vcpu-1gb-tor1-01.ssh: Flags [.], ack 3371016, win 2003, options [nop,nop,TS val 1127861344 ecr 1242479531], length 0
15:13:55.738858 IP 198.96.85.21.62430 > lamp-s-1vcpu-1gb-tor1-01.ssh: Flags [.], ack 3371236, win 1999, options [nop,nop,TS val 1127861344 ecr 1242479531], length 0
15:13:55.738861 IP 198.96.85.21.62430 > lamp-s-1vcpu-1gb-tor1-01.ssh: Flags [.], ack 3371456, win 1996, options [nop,nop,TS val 1127861344 ecr 1242479531], length 0
15:13:55.738865 IP 198.96.85.21.62430 > lamp-s-1vcpu-1gb-tor1-01.ssh: Flags [.], ack 3371456, win 2048, options [nop,nop,TS val 1127861344 ecr 1242479531], length 0
15:13:55.739015 IP lamp-s-1vcpu-1gb-tor1-01.ssh > 198.96.85.21.62430: Flags [P.], seq 3380056:3380276, ack 2161, win 309, options [nop,nop,TS val 1242479534 ecr 1127861344], length 220
15:13:55.739110 IP 198.96.85.21.62430 > lamp-s-1vcpu-1gb-tor1-01.ssh: Flags [.], ack 3371676, win 2044, options [nop,nop,TS val 1127861344 ecr 1242479531], length 0
15:13:55.739169 IP 198.96.85.21.62430 > lamp-s-1vcpu-1gb-tor1-01.ssh: Flags [.], ack 3371896, win 2041, options [nop,nop,TS val 1127861344 ecr 1242479531], length 0
15:13:55.739180 IP 198.96.85.21.62430 > lamp-s-1vcpu-1gb-tor1-01.ssh: Flags [.], ack 3372116, win 2037, options [nop,nop,TS val 1127861344 ecr 1242479531], length 0
15:13:55.739184 IP 198.96.85.21.62430 > lamp-s-1vcpu-1gb-tor1-01.ssh: Flags [.], ack 3373688, win 2023, options [nop,nop,TS val 1127861344 ecr 1242479532], length 0
15:13:55.739188 IP 198.96.85.21.62430 > lamp-s-1vcpu-1gb-tor1-01.ssh: Flags [.], ack 3373916, win 2044, options [nop,nop,TS val 1127861345 ecr 1242479532], length 0
15:13:55.739192 IP 198.96.85.21.62430 > lamp-s-1vcpu-1gb-tor1-01.ssh: Flags [.], ack 3374136, win 2044, options [nop,nop,TS val 1127861345 ecr 1242479532], length 0
15:13:55.739204 IP 198.96.85.21.62430 > lamp-s-1vcpu-1gb-tor1-01.ssh: Flags [.], ack 3374356, win 2041, options [nop,nop,TS val 1127861345 ecr 1242479532], length 0
15:13:55.739379 IP lamp-s-1vcpu-1gb-tor1-01.ssh > 198.96.85.21.62430: Flags [P.], seq 3380276:3381472, ack 2161, win 309, options [nop,nop,TS val 1242479534 ecr 1127861345], length 1196
15:13:55.739432 IP lamp-s-1vcpu-1gb-tor1-01.ssh > 198.96.85.21.62430: Flags [P.], seq 3381472:3382860, ack 2161, win 309, options [nop,nop,TS val 1242479535 ecr 1127861345], length 1388
15:13:55.739536 IP lamp-s-1vcpu-1gb-tor1-01.ssh > 198.96.85.21.62430: Flags [P.], seq 3382860:3383272, ack 2161, win 309, options [nop,nop,TS val 1242479535 ecr 1127861345], length 412
15:13:55.739646 IP lamp-s-1vcpu-1gb-tor1-01.ssh > 198.96.85.21.62430: Flags [P.], seq 3383272:3383492, ack 2161, win 309, options [nop,nop,TS val 1242479535 ecr 1127861345], length 220
15:13:55.739783 IP lamp-s-1vcpu-1gb-tor1-01.ssh > 198.96.85.21.62430: Flags [P.], seq 3383492:3383712, ack 2161, win 309, options [nop,nop,TS val 1242479535 ecr 1127861345], length 220
15:13:55.739884 IP lamp-s-1vcpu-1gb-tor1-01.ssh > 198.96.85.21.62430: Flags [P.], seq 3383712:3383932, ack 2161, win 309, options [nop,nop,TS val 1242479535 ecr 1127861345], length 220
15:13:55.739994 IP lamp-s-1vcpu-1gb-tor1-01.ssh > 198.96.85.21.62430: Flags [P.], seq 3383932:3384152, ack 2161, win 309, options [nop,nop,TS val 1242479535 ecr 1127861345], length 220
15:13:55.740103 IP lamp-s-1vcpu-1gb-tor1-01.ssh > 198.96.85.21.62430: Flags [P.], seq 3384152:3384372, ack 2161, win 309, options [nop,nop,TS val 1242479535 ecr 1127861345], length 220
15:13:55.740191 IP lamp-s-1vcpu-1gb-tor1-01.ssh > 198.96.85.21.62430: Flags [P.], seq 3384372:3384592, ack 2161, win 309, options [nop,nop,TS val 1242479535 ecr 1127861345], length 220
15:13:55.740281 IP lamp-s-1vcpu-1gb-tor1-01.ssh > 198.96.85.21.62430: Flags [P.], seq 3384592:3384812, ack 2161, win 309, options [nop,nop,TS val 1242479535 ecr 1127861345], length 220
15:13:55.740367 IP lamp-s-1vcpu-1gb-tor1-01.ssh > 198.96.85.21.62430: Flags [P.], seq 3384812:3385032, ack 2161, win 309, options [nop,nop,TS val 1242479535 ecr 1127861345], length 220
15:13:55.740457 IP lamp-s-1vcpu-1gb-tor1-01.ssh > 198.96.85.21.62430: Flags [P.], seq 3385032:3385252, ack 2161, win 309, options [nop,nop,TS val 1242479536 ecr 1127861345], length 220
15:13:55.740542 IP lamp-s-1vcpu-1gb-tor1-01.ssh > 198.96.85.21.62430: Flags [P.], seq 3385252:3385472, ack 2161, win 309, options [nop,nop,TS val 1242479536 ecr 1127861345], length 220
15:13:55.740630 IP lamp-s-1vcpu-1gb-tor1-01.ssh > 198.96.85.21.62430: Flags [P.], seq 3385472:3385692, ack 2161, win 309, options [nop,nop,TS val 1242479536 ecr 1127861345], length 220
15:13:55.740667 IP 198.96.85.21.62430 > lamp-s-1vcpu-1gb-tor1-01.ssh: Flags [.], ack 3376632, win 2044, options [nop,nop,TS val 1127861346 ecr 1242479533], length 0
15:13:55.740679 IP 198.96.85.21.62430 > lamp-s-1vcpu-1gb-tor1-01.ssh: Flags [.], ack 3376852, win 2041, options [nop,nop,TS val 1127861346 ecr 1242479533], length 0
15:13:55.740790 IP lamp-s-1vcpu-1gb-tor1-01.ssh > 198.96.85.21.62430: Flags [P.], seq 3385692:3386248, ack 2161, win 309, options [nop,nop,TS val 1242479536 ecr 1127861346], length 556
15:13:55.740884 IP lamp-s-1vcpu-1gb-tor1-01.ssh > 198.96.85.21.62430: Flags [P.], seq 3386248:3386468, ack 2161, win 309, options [nop,nop,TS val 1242479536 ecr 1127861346], length 220
15:13:55.740968 IP lamp-s-1vcpu-1gb-tor1-01.ssh > 198.96.85.21.62430: Flags [P.], seq 3386468:3386688, ack 2161, win 309, options [nop,nop,TS val 1242479536 ecr 1127861346], length 220
15:13:55.741053 IP lamp-s-1vcpu-1gb-tor1-01.ssh > 198.96.85.21.62430: Flags [P.], seq 3386688:3386908, ack 2161, win 309, options [nop,nop,TS val 1242479536 ecr 1127861346], length 220
15:13:55.741156 IP lamp-s-1vcpu-1gb-tor1-01.ssh > 198.96.85.21.62430: Flags [P.], seq 3386908:3387128, ack 2161, win 309, options [nop,nop,TS val 1242479536 ecr 1127861346], length 220
15:13:55.741261 IP lamp-s-1vcpu-1gb-tor1-01.ssh > 198.96.85.21.62430: Flags [P.], seq 3387128:3387348, ack 2161, win 309, options [nop,nop,TS val 1242479536 ecr 1127861346], length 220
15:13:55.741366 IP 198.96.85.21.62430 > lamp-s-1vcpu-1gb-tor1-01.ssh: Flags [.], ack 3377072, win 2037, options [nop,nop,TS val 1127861346 ecr 1242479533], length 0
15:13:55.741376 IP 198.96.85.21.62430 > lamp-s-1vcpu-1gb-tor1-01.ssh: Flags [.], ack 3377444, win 2042, options [nop,nop,TS val 1127861346 ecr 1242479533], length 0
15:13:55.741380 IP 198.96.85.21.62430 > lamp-s-1vcpu-1gb-tor1-01.ssh: Flags [.], ack 3377856, win 2041, options [nop,nop,TS val 1127861346 ecr 1242479533], length 0
15:13:55.741384 IP 198.96.85.21.62430 > lamp-s-1vcpu-1gb-tor1-01.ssh: Flags [.], ack 3378076, win 2038, options [nop,nop,TS val 1127861346 ecr 1242479533], length 0
15:13:55.741387 IP 198.96.85.21.62430 > lamp-s-1vcpu-1gb-tor1-01.ssh: Flags [.], ack 3378296, win 2034, options [nop,nop,TS val 1127861346 ecr 1242479533], length 0
15:13:55.741390 IP 198.96.85.21.62430 > lamp-s-1vcpu-1gb-tor1-01.ssh: Flags [.], ack 3378516, win 2031, options [nop,nop,TS val 1127861346 ecr 1242479533], length 0
15:13:55.741392 IP 198.96.85.21.62430 > lamp-s-1vcpu-1gb-tor1-01.ssh: Flags [.], ack 3378736, win 2027, options [nop,nop,TS val 1127861346 ecr 1242479533], length 0
15:13:55.741505 IP 198.96.85.21.62430 > lamp-s-1vcpu-1gb-tor1-01.ssh: Flags [.], ack 3380276, win 2037, options [nop,nop,TS val 1127861346 ecr 1242479534], length 0
15:13:55.741709 IP lamp-s-1vcpu-1gb-tor1-01.ssh > 198.96.85.21.62430: Flags [P.], seq 3387568:3388932, ack 2161, win 309, options [nop,nop,TS val 1242479537 ecr 1127861346], length 1364
15:13:55.741812 IP lamp-s-1vcpu-1gb-tor1-01.ssh > 198.96.85.21.62430: Flags [P.], seq 3388932:3389160, ack 2161, win 309, options [nop,nop,TS val 1242479537 ecr 1127861346], length 228
15:13:55.741906 IP lamp-s-1vcpu-1gb-tor1-01.ssh > 198.96.85.21.62430: Flags [P.], seq 3389160:3389380, ack 2161, win 309, options [nop,nop,TS val 1242479537 ecr 1127861346], length 220
15:13:55.742005 IP lamp-s-1vcpu-1gb-tor1-01.ssh > 198.96.85.21.62430: Flags [P.], seq 3389380:3389600, ack 2161, win 309, options [nop,nop,TS val 1242479537 ecr 1127861346], length 220
15:13:55.742096 IP lamp-s-1vcpu-1gb-tor1-01.ssh > 198.96.85.21.62430: Flags [P.], seq 3389600:3389820, ack 2161, win 309, options [nop,nop,TS val 1242479537 ecr 1127861346], length 220
15:13:55.742119 IP 198.96.85.21.62430 > lamp-s-1vcpu-1gb-tor1-01.ssh: Flags [.], ack 3381472, win 2029, options [nop,nop,TS val 1127861347 ecr 1242479534], length 0
15:13:55.742126 IP 198.96.85.21.62430 > lamp-s-1vcpu-1gb-tor1-01.ssh: Flags [.], ack 3382860, win 2007, options [nop,nop,TS val 1127861347 ecr 1242479535], length 0
15:13:55.742129 IP 198.96.85.21.62430 > lamp-s-1vcpu-1gb-tor1-01.ssh: Flags [.], ack 3383272, win 2001, options [nop,nop,TS val 1127861347 ecr 1242479535], length 0
15:13:55.742132 IP 198.96.85.21.62430 > lamp-s-1vcpu-1gb-tor1-01.ssh: Flags [.], ack 3383272, win 2048, options [nop,nop,TS val 1127861347 ecr 1242479535], length 0
15:13:55.742281 IP lamp-s-1vcpu-1gb-tor1-01.ssh > 198.96.85.21.62430: Flags [P.], seq 3389820:3390704, ack 2161, win 309, options [nop,nop,TS val 1242479537 ecr 1127861347], length 884
15:13:55.742375 IP lamp-s-1vcpu-1gb-tor1-01.ssh > 198.96.85.21.62430: Flags [P.], seq 3390704:3390924, ack 2161, win 309, options [nop,nop,TS val 1242479537 ecr 1127861347], length 220
15:13:55.742466 IP lamp-s-1vcpu-1gb-tor1-01.ssh > 198.96.85.21.62430: Flags [P.], seq 3390924:3391144, ack 2161, win 309, options [nop,nop,TS val 1242479538 ecr 1127861347], length 220
15:13:55.742551 IP lamp-s-1vcpu-1gb-tor1-01.ssh > 198.96.85.21.62430: Flags [P.], seq 3391144:3391364, ack 2161, win 309, options [nop,nop,TS val 1242479538 ecr 1127861347], length 220
15:13:55.742639 IP lamp-s-1vcpu-1gb-tor1-01.ssh > 198.96.85.21.62430: Flags [P.], seq 3391364:3391584, ack 2161, win 309, options [nop,nop,TS val 1242479538 ecr 1127861347], length 220
15:13:55.742750 IP lamp-s-1vcpu-1gb-tor1-01.ssh > 198.96.85.21.62430: Flags [P.], seq 3391584:3391804, ack 2161, win 309, options [nop,nop,TS val 1242479538 ecr 1127861347], length 220
15:13:55.742857 IP lamp-s-1vcpu-1gb-tor1-01.ssh > 198.96.85.21.62430: Flags [P.], seq 3391804:3392024, ack 2161, win 309, options [nop,nop,TS val 1242479538 ecr 1127861347], length 220
15:13:55.742945 IP lamp-s-1vcpu-1gb-tor1-01.ssh > 198.96.85.21.62430: Flags [P.], seq 3392024:3392244, ack 2161, win 309, options [nop,nop,TS val 1242479538 ecr 1127861347], length 220
15:13:55.743034 IP lamp-s-1vcpu-1gb-tor1-01.ssh > 198.96.85.21.62430: Flags [P.], seq 3392244:3392464, ack 2161, win 309, options [nop,nop,TS val 1242479538 ecr 1127861347], length 220
15:13:55.743126 IP 198.96.85.21.62430 > lamp-s-1vcpu-1gb-tor1-01.ssh: Flags [.], ack 3383492, win 2044, options [nop,nop,TS val 1127861348 ecr 1242479535], length 0
15:13:55.743136 IP 198.96.85.21.62430 > lamp-s-1vcpu-1gb-tor1-01.ssh: Flags [.], ack 3383712, win 2041, options [nop,nop,TS val 1127861348 ecr 1242479535], length 0
15:13:55.743144 IP lamp-s-1vcpu-1gb-tor1-01.ssh > 198.96.85.21.62430: Flags [P.], seq 3392464:3392684, ack 2161, win 309, options [nop,nop,TS val 1242479538 ecr 1127861347], length 220
15:13:55.743291 IP lamp-s-1vcpu-1gb-tor1-01.ssh > 198.96.85.21.62430: Flags [P.], seq 3392684:3393240, ack 2161, win 309, options [nop,nop,TS val 1242479538 ecr 1127861348], length 556
15:13:55.743380 IP lamp-s-1vcpu-1gb-tor1-01.ssh > 198.96.85.21.62430: Flags [P.], seq 3393240:3393460, ack 2161, win 309, options [nop,nop,TS val 1242479538 ecr 1127861348], length 220
15:13:55.743469 IP lamp-s-1vcpu-1gb-tor1-01.ssh > 198.96.85.21.62430: Flags [P.], seq 3393460:3393680, ack 2161, win 309, options [nop,nop,TS val 1242479539 ecr 1127861348], length 220
15:13:55.743554 IP lamp-s-1vcpu-1gb-tor1-01.ssh > 198.96.85.21.62430: Flags [P.], seq 3393680:3393900, ack 2161, win 309, options [nop,nop,TS val 1242479539 ecr 1127861348], length 220
15:13:55.743642 IP lamp-s-1vcpu-1gb-tor1-01.ssh > 198.96.85.21.62430: Flags [P.], seq 3393900:3394120, ack 2161, win 309, options [nop,nop,TS val 1242479539 ecr 1127861348], length 220
15:13:55.743747 IP lamp-s-1vcpu-1gb-tor1-01.ssh > 198.96.85.21.62430: Flags [P.], seq 3394120:3394340, ack 2161, win 309, options [nop,nop,TS val 1242479539 ecr 1127861348], length 220
15:13:55.743849 IP 198.96.85.21.62430 > lamp-s-1vcpu-1gb-tor1-01.ssh: Flags [.], ack 3383932, win 2037, options [nop,nop,TS val 1127861348 ecr 1242479535], length 0
15:13:55.743866 IP 198.96.85.21.62430 > lamp-s-1vcpu-1gb-tor1-01.ssh: Flags [.], ack 3384152, win 2034, options [nop,nop,TS val 1127861348 ecr 1242479535], length 0
15:13:55.743871 IP 198.96.85.21.62430 > lamp-s-1vcpu-1gb-tor1-01.ssh: Flags [.], ack 3384372, win 2030, options [nop,nop,TS val 1127861348 ecr 1242479535], length 0
15:13:55.743875 IP 198.96.85.21.62430 > lamp-s-1vcpu-1gb-tor1-01.ssh: Flags [.], ack 3384592, win 2044, options [nop,nop,TS val 1127861348 ecr 1242479535], length 0
15:13:55.743880 IP 198.96.85.21.62430 > lamp-s-1vcpu-1gb-tor1-01.ssh: Flags [.], ack 3384812, win 2041, options [nop,nop,TS val 1127861348 ecr 1242479535], length 0
15:13:55.744020 IP lamp-s-1vcpu-1gb-tor1-01.ssh > 198.96.85.21.62430: Flags [P.], seq 3394340:3395392, ack 2161, win 309, options [nop,nop,TS val 1242479539 ecr 1127861348], length 1052
15:13:55.744120 IP 198.96.85.21.62430 > lamp-s-1vcpu-1gb-tor1-01.ssh: Flags [.], ack 3385032, win 2037, options [nop,nop,TS val 1127861348 ecr 1242479535], length 0
15:13:55.744131 IP 198.96.85.21.62430 > lamp-s-1vcpu-1gb-tor1-01.ssh: Flags [.], ack 3385252, win 2034, options [nop,nop,TS val 1127861348 ecr 1242479536], length 0
15:13:55.744134 IP 198.96.85.21.62430 > lamp-s-1vcpu-1gb-tor1-01.ssh: Flags [.], ack 3385472, win 2030, options [nop,nop,TS val 1127861348 ecr 1242479536], length 0
15:13:55.744137 IP 198.96.85.21.62430 > lamp-s-1vcpu-1gb-tor1-01.ssh: Flags [.], ack 3385692, win 2027, options [nop,nop,TS val 1127861348 ecr 1242479536], length 0
15:13:55.744140 IP 198.96.85.21.62430 > lamp-s-1vcpu-1gb-tor1-01.ssh: Flags [.], ack 3386248, win 2018, options [nop,nop,TS val 1127861348 ecr 1242479536], length 0
15:13:55.744143 IP 198.96.85.21.62430 > lamp-s-1vcpu-1gb-tor1-01.ssh: Flags [.], ack 3386468, win 2015, options [nop,nop,TS val 1127861348 ecr 1242479536], length 0
15:13:55.744147 IP 198.96.85.21.62430 > lamp-s-1vcpu-1gb-tor1-01.ssh: Flags [.], ack 3386688, win 2011, options [nop,nop,TS val 1127861348 ecr 1242479536], length 0
15:13:55.744386 IP lamp-s-1vcpu-1gb-tor1-01.ssh > 198.96.85.21.62430: Flags [P.], seq 3395620:3396816, ack 2161, win 309, options [nop,nop,TS val 1242479540 ecr 1127861348], length 1196
15:13:55.744485 IP lamp-s-1vcpu-1gb-tor1-01.ssh > 198.96.85.21.62430: Flags [P.], seq 3396816:3397044, ack 2161, win 309, options [nop,nop,TS val 1242479540 ecr 1127861348], length 228
15:13:55.744572 IP lamp-s-1vcpu-1gb-tor1-01.ssh > 198.96.85.21.62430: Flags [P.], seq 3397044:3397264, ack 2161, win 309, options [nop,nop,TS val 1242479540 ecr 1127861348], length 220
15:13:55.744664 IP lamp-s-1vcpu-1gb-tor1-01.ssh > 198.96.85.21.62430: Flags [P.], seq 3397264:3397484, ack 2161, win 309, options [nop,nop,TS val 1242479540 ecr 1127861348], length 220
15:13:55.744753 IP lamp-s-1vcpu-1gb-tor1-01.ssh > 198.96.85.21.62430: Flags [P.], seq 3397484:3397704, ack 2161, win 309, options [nop,nop,TS val 1242479540 ecr 1127861348], length 220
15:13:55.744843 IP lamp-s-1vcpu-1gb-tor1-01.ssh > 198.96.85.21.62430: Flags [P.], seq 3397704:3397924, ack 2161, win 309, options [nop,nop,TS val 1242479540 ecr 1127861348], length 220
15:13:55.744929 IP lamp-s-1vcpu-1gb-tor1-01.ssh > 198.96.85.21.62430: Flags [P.], seq 3397924:3398144, ack 2161, win 309, options [nop,nop,TS val 1242479540 ecr 1127861348], length 220
15:13:55.745017 IP lamp-s-1vcpu-1gb-tor1-01.ssh > 198.96.85.21.62430: Flags [P.], seq 3398144:3398364, ack 2161, win 309, options [nop,nop,TS val 1242479540 ecr 1127861348], length 220
15:13:55.745101 IP lamp-s-1vcpu-1gb-tor1-01.ssh > 198.96.85.21.62430: Flags [P.], seq 3398364:3398584, ack 2161, win 309, options [nop,nop,TS val 1242479540 ecr 1127861348], length 220
15:13:55.745190 IP lamp-s-1vcpu-1gb-tor1-01.ssh > 198.96.85.21.62430: Flags [P.], seq 3398584:3398804, ack 2161, win 309, options [nop,nop,TS val 1242479540 ecr 1127861348], length 220
15:13:55.745275 IP lamp-s-1vcpu-1gb-tor1-01.ssh > 198.96.85.21.62430: Flags [P.], seq 3398804:3399024, ack 2161, win 309, options [nop,nop,TS val 1242479540 ecr 1127861348], length 220
15:13:55.745363 IP lamp-s-1vcpu-1gb-tor1-01.ssh > 198.96.85.21.62430: Flags [P.], seq 3399024:3399244, ack 2161, win 309, options [nop,nop,TS val 1242479540 ecr 1127861348], length 220
15:13:55.745451 IP lamp-s-1vcpu-1gb-tor1-01.ssh > 198.96.85.21.62430: Flags [P.], seq 3399244:3399464, ack 2161, win 309, options [nop,nop,TS val 1242479541 ecr 1127861348], length 220
15:13:55.745540 IP lamp-s-1vcpu-1gb-tor1-01.ssh > 198.96.85.21.62430: Flags [P.], seq 3399464:3399684, ack 2161, win 309, options [nop,nop,TS val 1242479541 ecr 1127861348], length 220
15:13:55.745653 IP lamp-s-1vcpu-1gb-tor1-01.ssh > 198.96.85.21.62430: Flags [P.], seq 3399684:3399904, ack 2161, win 309, options [nop,nop,TS val 1242479541 ecr 1127861348], length 220
15:13:55.745742 IP lamp-s-1vcpu-1gb-tor1-01.ssh > 198.96.85.21.62430: Flags [P.], seq 3399904:3400124, ack 2161, win 309, options [nop,nop,TS val 1242479541 ecr 1127861348], length 220
15:13:55.745826 IP lamp-s-1vcpu-1gb-tor1-01.ssh > 198.96.85.21.62430: Flags [P.], seq 3400124:3400344, ack 2161, win 309, options [nop,nop,TS val 1242479541 ecr 1127861348], length 220
15:13:55.745911 IP lamp-s-1vcpu-1gb-tor1-01.ssh > 198.96.85.21.62430: Flags [P.], seq 3400344:3400564, ack 2161, win 309, options [nop,nop,TS val 1242479541 ecr 1127861348], length 220
15:13:55.745979 IP 198.96.85.21.62430 > lamp-s-1vcpu-1gb-tor1-01.ssh: Flags [.], ack 3388932, win 2026, options [nop,nop,TS val 1127861348 ecr 1242479537], length 0
15:13:55.745992 IP 198.96.85.21.62430 > lamp-s-1vcpu-1gb-tor1-01.ssh: Flags [.], ack 3389160, win 2044, options [nop,nop,TS val 1127861349 ecr 1242479537], length 0
15:13:55.746084 IP lamp-s-1vcpu-1gb-tor1-01.ssh > 198.96.85.21.62430: Flags [P.], seq 3400564:3401120, ack 2161, win 309, options [nop,nop,TS val 1242479541 ecr 1127861349], length 556
15:13:55.746174 IP lamp-s-1vcpu-1gb-tor1-01.ssh > 198.96.85.21.62430: Flags [P.], seq 3401120:3401340, ack 2161, win 309, options [nop,nop,TS val 1242479541 ecr 1127861349], length 220
15:13:55.746260 IP lamp-s-1vcpu-1gb-tor1-01.ssh > 198.96.85.21.62430: Flags [P.], seq 3401340:3401560, ack 2161, win 309, options [nop,nop,TS val 1242479541 ecr 1127861349], length 220
15:13:55.746348 IP lamp-s-1vcpu-1gb-tor1-01.ssh > 198.96.85.21.62430: Flags [P.], seq 3401560:3401780, ack 2161, win 309, options [nop,nop,TS val 1242479541 ecr 1127861349], length 220
15:13:55.746449 IP lamp-s-1vcpu-1gb-tor1-01.ssh > 198.96.85.21.62430: Flags [P.], seq 3401780:3402000, ack 2161, win 309, options [nop,nop,TS val 1242479542 ecr 1127861349], length 220
15:13:55.746538 IP lamp-s-1vcpu-1gb-tor1-01.ssh > 198.96.85.21.62430: Flags [P.], seq 3402000:3402220, ack 2161, win 309, options [nop,nop,TS val 1242479542 ecr 1127861349], length 220
15:13:55.746624 IP 198.96.85.21.62430 > lamp-s-1vcpu-1gb-tor1-01.ssh: Flags [.], ack 3389380, win 2041, options [nop,nop,TS val 1127861349 ecr 1242479537], length 0
15:13:55.746637 IP 198.96.85.21.62430 > lamp-s-1vcpu-1gb-tor1-01.ssh: Flags [.], ack 3389600, win 2037, options [nop,nop,TS val 1127861349 ecr 1242479537], length 0
15:13:55.746642 IP 198.96.85.21.62430 > lamp-s-1vcpu-1gb-tor1-01.ssh: Flags [.], ack 3389820, win 2034, options [nop,nop,TS val 1127861349 ecr 1242479537], length 0
15:13:55.746646 IP 198.96.85.21.62430 > lamp-s-1vcpu-1gb-tor1-01.ssh: Flags [.], ack 3390704, win 2020, options [nop,nop,TS val 1127861349 ecr 1242479537], length 0
15:13:55.746650 IP 198.96.85.21.62430 > lamp-s-1vcpu-1gb-tor1-01.ssh: Flags [.], ack 3390924, win 2044, options [nop,nop,TS val 1127861349 ecr 1242479537], length 0
15:13:55.746789 IP 198.96.85.21.62430 > lamp-s-1vcpu-1gb-tor1-01.ssh: Flags [.], ack 3391144, win 2041, options [nop,nop,TS val 1127861349 ecr 1242479538], length 0
15:13:55.746804 IP 198.96.85.21.62430 > lamp-s-1vcpu-1gb-tor1-01.ssh: Flags [.], ack 3391364, win 2037, options [nop,nop,TS val 1127861349 ecr 1242479538], length 0
15:13:55.746809 IP 198.96.85.21.62430 > lamp-s-1vcpu-1gb-tor1-01.ssh: Flags [.], ack 3391584, win 2034, options [nop,nop,TS val 1127861349 ecr 1242479538], length 0
15:13:55.746813 IP 198.96.85.21.62430 > lamp-s-1vcpu-1gb-tor1-01.ssh: Flags [.], ack 3391804, win 2030, options [nop,nop,TS val 1127861349 ecr 1242479538], length 0
15:13:55.746817 IP 198.96.85.21.62430 > lamp-s-1vcpu-1gb-tor1-01.ssh: Flags [.], ack 3392024, win 2027, options [nop,nop,TS val 1127861349 ecr 1242479538], length 0
15:13:55.746821 IP 198.96.85.21.62430 > lamp-s-1vcpu-1gb-tor1-01.ssh: Flags [.], ack 3392244, win 2023, options [nop,nop,TS val 1127861349 ecr 1242479538], length 0
