16:48:29.138297 IP lamp-s-1vcpu-1gb-tor1-01.ssh > 198.96.85.21.50318: Flags [P.], seq 1719968:1720188, ack 1045, win 309, options [nop,nop,TS val 2519125205 ecr 440440712], length 220
16:48:29.138492 IP lamp-s-1vcpu-1gb-tor1-01.ssh > 198.96.85.21.50318: Flags [P.], seq 1720188:1720408, ack 1045, win 309, options [nop,nop,TS val 2519125205 ecr 440440712], length 220
16:48:29.138691 IP lamp-s-1vcpu-1gb-tor1-01.ssh > 198.96.85.21.50318: Flags [P.], seq 1720408:1720628, ack 1045, win 309, options [nop,nop,TS val 2519125205 ecr 440440712], length 220
16:48:29.138921 IP lamp-s-1vcpu-1gb-tor1-01.ssh > 198.96.85.21.50318: Flags [P.], seq 1720628:1720848, ack 1045, win 309, options [nop,nop,TS val 2519125206 ecr 440440712], length 220
16:48:29.139042 IP lamp-s-1vcpu-1gb-tor1-01.ssh > 198.96.85.21.50318: Flags [P.], seq 1720848:1721068, ack 1045, win 309, options [nop,nop,TS val 2519125206 ecr 440440712], length 220
16:48:29.139151 IP lamp-s-1vcpu-1gb-tor1-01.ssh > 198.96.85.21.50318: Flags [P.], seq 1721068:1721288, ack 1045, win 309, options [nop,nop,TS val 2519125206 ecr 440440712], length 220
16:48:29.139300 IP lamp-s-1vcpu-1gb-tor1-01.ssh > 198.96.85.21.50318: Flags [P.], seq 1721288:1721508, ack 1045, win 309, options [nop,nop,TS val 2519125206 ecr 440440712], length 220
16:48:29.139484 IP lamp-s-1vcpu-1gb-tor1-01.ssh > 198.96.85.21.50318: Flags [P.], seq 1721508:1721728, ack 1045, win 309, options [nop,nop,TS val 2519125206 ecr 440440712], length 220
16:48:29.139659 IP lamp-s-1vcpu-1gb-tor1-01.ssh > 198.96.85.21.50318: Flags [P.], seq 1721728:1721948, ack 1045, win 309, options [nop,nop,TS val 2519125206 ecr 440440712], length 220
16:48:29.139774 IP lamp-s-1vcpu-1gb-tor1-01.ssh > 198.96.85.21.50318: Flags [P.], seq 1721948:1722168, ack 1045, win 309, options [nop,nop,TS val 2519125206 ecr 440440712], length 220
16:48:29.139885 IP lamp-s-1vcpu-1gb-tor1-01.ssh > 198.96.85.21.50318: Flags [P.], seq 1722168:1722388, ack 1045, win 309, options [nop,nop,TS val 2519125206 ecr 440440712], length 220
16:48:29.139990 IP lamp-s-1vcpu-1gb-tor1-01.ssh > 198.96.85.21.50318: Flags [P.], seq 1722388:1722608, ack 1045, win 309, options [nop,nop,TS val 2519125207 ecr 440440712], length 220
16:48:29.140095 IP lamp-s-1vcpu-1gb-tor1-01.ssh > 198.96.85.21.50318: Flags [P.], seq 1722608:1722828, ack 1045, win 309, options [nop,nop,TS val 2519125207 ecr 440440712], length 220
16:48:29.140204 IP lamp-s-1vcpu-1gb-tor1-01.ssh > 198.96.85.21.50318: Flags [P.], seq 1722828:1723048, ack 1045, win 309, options [nop,nop,TS val 2519125207 ecr 440440712], length 220
16:48:29.140409 IP lamp-s-1vcpu-1gb-tor1-01.ssh > 198.96.85.21.50318: Flags [P.], seq 1723048:1723268, ack 1045, win 309, options [nop,nop,TS val 2519125207 ecr 440440712], length 220
16:48:29.140596 IP lamp-s-1vcpu-1gb-tor1-01.ssh > 198.96.85.21.50318: Flags [P.], seq 1723268:1723488, ack 1045, win 309, options [nop,nop,TS val 2519125207 ecr 440440712], length 220
16:48:29.140765 IP lamp-s-1vcpu-1gb-tor1-01.ssh > 198.96.85.21.50318: Flags [P.], seq 1723488:1723708, ack 1045, win 309, options [nop,nop,TS val 2519125207 ecr 440440712], length 220
16:48:29.140917 IP lamp-s-1vcpu-1gb-tor1-01.ssh > 198.96.85.21.50318: Flags [P.], seq 1723708:1723928, ack 1045, win 309, options [nop,nop,TS val 2519125208 ecr 440440712], length 220
16:48:29.141063 IP lamp-s-1vcpu-1gb-tor1-01.ssh > 198.96.85.21.50318: Flags [P.], seq 1723928:1724148, ack 1045, win 309, options [nop,nop,TS val 2519125208 ecr 440440712], length 220
16:48:29.141180 IP lamp-s-1vcpu-1gb-tor1-01.ssh > 198.96.85.21.50318: Flags [P.], seq 1724148:1724368, ack 1045, win 309, options [nop,nop,TS val 2519125208 ecr 440440712], length 220
16:48:29.141292 IP lamp-s-1vcpu-1gb-tor1-01.ssh > 198.96.85.21.50318: Flags [P.], seq 1724368:1724588, ack 1045, win 309, options [nop,nop,TS val 2519125208 ecr 440440712], length 220
16:48:29.141482 IP lamp-s-1vcpu-1gb-tor1-01.ssh > 198.96.85.21.50318: Flags [P.], seq 1724588:1724808, ack 1045, win 309, options [nop,nop,TS val 2519125208 ecr 440440712], length 220
16:48:29.141665 IP lamp-s-1vcpu-1gb-tor1-01.ssh > 198.96.85.21.50318: Flags [P.], seq 1724808:1725028, ack 1045, win 309, options [nop,nop,TS val 2519125208 ecr 440440712], length 220
16:48:29.141848 IP lamp-s-1vcpu-1gb-tor1-01.ssh > 198.96.85.21.50318: Flags [P.], seq 1725028:1725248, ack 1045, win 309, options [nop,nop,TS val 2519125208 ecr 440440712], length 220
16:48:29.142011 IP lamp-s-1vcpu-1gb-tor1-01.ssh > 198.96.85.21.50318: Flags [P.], seq 1725248:1725468, ack 1045, win 309, options [nop,nop,TS val 2519125209 ecr 440440712], length 220
16:48:29.142129 IP lamp-s-1vcpu-1gb-tor1-01.ssh > 198.96.85.21.50318: Flags [P.], seq 1725468:1725688, ack 1045, win 309, options [nop,nop,TS val 2519125209 ecr 440440712], length 220
16:48:29.142240 IP lamp-s-1vcpu-1gb-tor1-01.ssh > 198.96.85.21.50318: Flags [P.], seq 1725688:1725908, ack 1045, win 309, options [nop,nop,TS val 2519125209 ecr 440440712], length 220
16:48:29.142347 IP lamp-s-1vcpu-1gb-tor1-01.ssh > 198.96.85.21.50318: Flags [P.], seq 1725908:1726128, ack 1045, win 309, options [nop,nop,TS val 2519125209 ecr 440440712], length 220
16:48:29.142452 IP lamp-s-1vcpu-1gb-tor1-01.ssh > 198.96.85.21.50318: Flags [P.], seq 1726128:1726348, ack 1045, win 309, options [nop,nop,TS val 2519125209 ecr 440440712], length 220
16:48:29.142568 IP lamp-s-1vcpu-1gb-tor1-01.ssh > 198.96.85.21.50318: Flags [P.], seq 1726348:1726568, ack 1045, win 309, options [nop,nop,TS val 2519125209 ecr 440440712], length 220
16:48:29.142673 IP lamp-s-1vcpu-1gb-tor1-01.ssh > 198.96.85.21.50318: Flags [P.], seq 1726568:1726788, ack 1045, win 309, options [nop,nop,TS val 2519125209 ecr 440440712], length 220
16:48:29.142818 IP lamp-s-1vcpu-1gb-tor1-01.ssh > 198.96.85.21.50318: Flags [P.], seq 1726788:1727008, ack 1045, win 309, options [nop,nop,TS val 2519125209 ecr 440440712], length 220
16:48:29.142930 IP lamp-s-1vcpu-1gb-tor1-01.ssh > 198.96.85.21.50318: Flags [P.], seq 1727008:1727228, ack 1045, win 309, options [nop,nop,TS val 2519125210 ecr 440440712], length 220
16:48:29.143036 IP lamp-s-1vcpu-1gb-tor1-01.ssh > 198.96.85.21.50318: Flags [P.], seq 1727228:1727448, ack 1045, win 309, options [nop,nop,TS val 2519125210 ecr 440440712], length 220
16:48:29.143141 IP lamp-s-1vcpu-1gb-tor1-01.ssh > 198.96.85.21.50318: Flags [P.], seq 1727448:1727668, ack 1045, win 309, options [nop,nop,TS val 2519125210 ecr 440440712], length 220
16:48:29.143246 IP lamp-s-1vcpu-1gb-tor1-01.ssh > 198.96.85.21.50318: Flags [P.], seq 1727668:1727888, ack 1045, win 309, options [nop,nop,TS val 2519125210 ecr 440440712], length 220
16:48:29.143352 IP lamp-s-1vcpu-1gb-tor1-01.ssh > 198.96.85.21.50318: Flags [P.], seq 1727888:1728108, ack 1045, win 309, options [nop,nop,TS val 2519125210 ecr 440440712], length 220
16:48:29.143478 IP lamp-s-1vcpu-1gb-tor1-01.ssh > 198.96.85.21.50318: Flags [P.], seq 1728108:1728328, ack 1045, win 309, options [nop,nop,TS val 2519125210 ecr 440440712], length 220
16:48:29.143585 IP lamp-s-1vcpu-1gb-tor1-01.ssh > 198.96.85.21.50318: Flags [P.], seq 1728328:1728548, ack 1045, win 309, options [nop,nop,TS val 2519125210 ecr 440440712], length 220
16:48:29.143690 IP lamp-s-1vcpu-1gb-tor1-01.ssh > 198.96.85.21.50318: Flags [P.], seq 1728548:1728768, ack 1045, win 309, options [nop,nop,TS val 2519125210 ecr 440440712], length 220
16:48:29.143797 IP lamp-s-1vcpu-1gb-tor1-01.ssh > 198.96.85.21.50318: Flags [P.], seq 1728768:1728988, ack 1045, win 309, options [nop,nop,TS val 2519125210 ecr 440440712], length 220
16:48:29.143901 IP lamp-s-1vcpu-1gb-tor1-01.ssh > 198.96.85.21.50318: Flags [P.], seq 1728988:1729208, ack 1045, win 309, options [nop,nop,TS val 2519125211 ecr 440440712], length 220
16:48:29.144006 IP lamp-s-1vcpu-1gb-tor1-01.ssh > 198.96.85.21.50318: Flags [P.], seq 1729208:1729428, ack 1045, win 309, options [nop,nop,TS val 2519125211 ecr 440440712], length 220
16:48:29.144111 IP lamp-s-1vcpu-1gb-tor1-01.ssh > 198.96.85.21.50318: Flags [P.], seq 1729428:1729648, ack 1045, win 309, options [nop,nop,TS val 2519125211 ecr 440440712], length 220
16:48:29.144216 IP lamp-s-1vcpu-1gb-tor1-01.ssh > 198.96.85.21.50318: Flags [P.], seq 1729648:1729868, ack 1045, win 309, options [nop,nop,TS val 2519125211 ecr 440440712], length 220
16:48:29.144321 IP lamp-s-1vcpu-1gb-tor1-01.ssh > 198.96.85.21.50318: Flags [P.], seq 1729868:1730088, ack 1045, win 309, options [nop,nop,TS val 2519125211 ecr 440440712], length 220
16:48:29.144505 IP lamp-s-1vcpu-1gb-tor1-01.ssh > 198.96.85.21.50318: Flags [P.], seq 1730088:1730308, ack 1045, win 309, options [nop,nop,TS val 2519125211 ecr 440440712], length 220
16:48:29.144665 IP lamp-s-1vcpu-1gb-tor1-01.ssh > 198.96.85.21.50318: Flags [P.], seq 1730308:1730528, ack 1045, win 309, options [nop,nop,TS val 2519125211 ecr 440440712], length 220
16:48:29.144781 IP lamp-s-1vcpu-1gb-tor1-01.ssh > 198.96.85.21.50318: Flags [P.], seq 1730528:1730748, ack 1045, win 309, options [nop,nop,TS val 2519125211 ecr 440440712], length 220
16:48:29.144890 IP lamp-s-1vcpu-1gb-tor1-01.ssh > 198.96.85.21.50318: Flags [P.], seq 1730748:1730968, ack 1045, win 309, options [nop,nop,TS val 2519125211 ecr 440440712], length 220
16:48:29.144996 IP lamp-s-1vcpu-1gb-tor1-01.ssh > 198.96.85.21.50318: Flags [P.], seq 1730968:1731188, ack 1045, win 309, options [nop,nop,TS val 2519125212 ecr 440440712], length 220
16:48:29.145102 IP lamp-s-1vcpu-1gb-tor1-01.ssh > 198.96.85.21.50318: Flags [P.], seq 1731188:1731408, ack 1045, win 309, options [nop,nop,TS val 2519125212 ecr 440440712], length 220
16:48:29.145206 IP lamp-s-1vcpu-1gb-tor1-01.ssh > 198.96.85.21.50318: Flags [P.], seq 1731408:1731628, ack 1045, win 309, options [nop,nop,TS val 2519125212 ecr 440440712], length 220
16:48:29.145257 IP 198.96.85.21.50318 > lamp-s-1vcpu-1gb-tor1-01.ssh: Flags [P.], seq 1045:1081, ack 1704588, win 2254, options [nop,nop,TS val 440440727 ecr 2519125186], length 36
^C
8267 packets captured
13639 packets received by filter
