16:46:51.573791 IP 165.227.43.194.22 > 198.96.85.21.50318: Flags [P.], seq 731032:731244, ack 433, win 309, options [nop,nop,TS val 2519027641 ecr 440343596], length 212
16:46:51.573890 IP 165.227.43.194.22 > 198.96.85.21.50318: Flags [P.], seq 731244:731456, ack 433, win 309, options [nop,nop,TS val 2519027641 ecr 440343596], length 212
16:46:51.573990 IP 165.227.43.194.22 > 198.96.85.21.50318: Flags [P.], seq 731456:731668, ack 433, win 309, options [nop,nop,TS val 2519027641 ecr 440343596], length 212
16:46:51.574087 IP 165.227.43.194.22 > 198.96.85.21.50318: Flags [P.], seq 731668:731880, ack 433, win 309, options [nop,nop,TS val 2519027641 ecr 440343596], length 212
16:46:51.574182 IP 165.227.43.194.22 > 198.96.85.21.50318: Flags [P.], seq 731880:732092, ack 433, win 309, options [nop,nop,TS val 2519027641 ecr 440343596], length 212
16:46:51.574278 IP 165.227.43.194.22 > 198.96.85.21.50318: Flags [P.], seq 732092:732304, ack 433, win 309, options [nop,nop,TS val 2519027641 ecr 440343596], length 212
16:46:51.574377 IP 165.227.43.194.22 > 198.96.85.21.50318: Flags [P.], seq 732304:732516, ack 433, win 309, options [nop,nop,TS val 2519027641 ecr 440343596], length 212
16:46:51.574468 IP 165.227.43.194.22 > 198.96.85.21.50318: Flags [P.], seq 732516:732728, ack 433, win 309, options [nop,nop,TS val 2519027641 ecr 440343596], length 212
16:46:51.574561 IP 165.227.43.194.22 > 198.96.85.21.50318: Flags [P.], seq 732728:732940, ack 433, win 309, options [nop,nop,TS val 2519027641 ecr 440343596], length 212
16:46:51.574666 IP 165.227.43.194.22 > 198.96.85.21.50318: Flags [P.], seq 732940:733152, ack 433, win 309, options [nop,nop,TS val 2519027641 ecr 440343596], length 212
16:46:51.574794 IP 165.227.43.194.22 > 198.96.85.21.50318: Flags [P.], seq 733152:733364, ack 433, win 309, options [nop,nop,TS val 2519027642 ecr 440343596], length 212
16:46:51.574893 IP 165.227.43.194.22 > 198.96.85.21.50318: Flags [P.], seq 733364:733576, ack 433, win 309, options [nop,nop,TS val 2519027642 ecr 440343596], length 212
16:46:51.575006 IP 165.227.43.194.22 > 198.96.85.21.50318: Flags [P.], seq 733576:733788, ack 433, win 309, options [nop,nop,TS val 2519027642 ecr 440343596], length 212
16:46:51.575105 IP 165.227.43.194.22 > 198.96.85.21.50318: Flags [P.], seq 733788:734000, ack 433, win 309, options [nop,nop,TS val 2519027642 ecr 440343596], length 212
16:46:51.575201 IP 165.227.43.194.22 > 198.96.85.21.50318: Flags [P.], seq 734000:734212, ack 433, win 309, options [nop,nop,TS val 2519027642 ecr 440343596], length 212
16:46:51.575298 IP 165.227.43.194.22 > 198.96.85.21.50318: Flags [P.], seq 734212:734424, ack 433, win 309, options [nop,nop,TS val 2519027642 ecr 440343596], length 212
16:46:51.575418 IP 165.227.43.194.22 > 198.96.85.21.50318: Flags [P.], seq 734424:734636, ack 433, win 309, options [nop,nop,TS val 2519027642 ecr 440343596], length 212
16:46:51.575518 IP 165.227.43.194.22 > 198.96.85.21.50318: Flags [P.], seq 734636:734848, ack 433, win 309, options [nop,nop,TS val 2519027642 ecr 440343596], length 212
16:46:51.575612 IP 165.227.43.194.22 > 198.96.85.21.50318: Flags [P.], seq 734848:735060, ack 433, win 309, options [nop,nop,TS val 2519027642 ecr 440343596], length 212
16:46:51.575707 IP 165.227.43.194.22 > 198.96.85.21.50318: Flags [P.], seq 735060:735272, ack 433, win 309, options [nop,nop,TS val 2519027642 ecr 440343596], length 212
16:46:51.575802 IP 165.227.43.194.22 > 198.96.85.21.50318: Flags [P.], seq 735272:735484, ack 433, win 309, options [nop,nop,TS val 2519027643 ecr 440343596], length 212
16:46:51.575900 IP 165.227.43.194.22 > 198.96.85.21.50318: Flags [P.], seq 735484:735696, ack 433, win 309, options [nop,nop,TS val 2519027643 ecr 440343596], length 212
16:46:51.576002 IP 165.227.43.194.22 > 198.96.85.21.50318: Flags [P.], seq 735696:735908, ack 433, win 309, options [nop,nop,TS val 2519027643 ecr 440343596], length 212
16:46:51.576098 IP 165.227.43.194.22 > 198.96.85.21.50318: Flags [P.], seq 735908:736120, ack 433, win 309, options [nop,nop,TS val 2519027643 ecr 440343596], length 212
16:46:51.576194 IP 165.227.43.194.22 > 198.96.85.21.50318: Flags [P.], seq 736120:736332, ack 433, win 309, options [nop,nop,TS val 2519027643 ecr 440343596], length 212
16:46:51.576289 IP 165.227.43.194.22 > 198.96.85.21.50318: Flags [P.], seq 736332:736544, ack 433, win 309, options [nop,nop,TS val 2519027643 ecr 440343596], length 212
16:46:51.576385 IP 165.227.43.194.22 > 198.96.85.21.50318: Flags [P.], seq 736544:736756, ack 433, win 309, options [nop,nop,TS val 2519027643 ecr 440343596], length 212
16:46:51.576479 IP 165.227.43.194.22 > 198.96.85.21.50318: Flags [P.], seq 736756:736968, ack 433, win 309, options [nop,nop,TS val 2519027643 ecr 440343596], length 212
16:46:51.576570 IP 165.227.43.194.22 > 198.96.85.21.50318: Flags [P.], seq 736968:737180, ack 433, win 309, options [nop,nop,TS val 2519027643 ecr 440343596], length 212
16:46:51.576662 IP 165.227.43.194.22 > 198.96.85.21.50318: Flags [P.], seq 737180:737392, ack 433, win 309, options [nop,nop,TS val 2519027643 ecr 440343596], length 212
16:46:51.576759 IP 165.227.43.194.22 > 198.96.85.21.50318: Flags [P.], seq 737392:737604, ack 433, win 309, options [nop,nop,TS val 2519027644 ecr 440343596], length 212
16:46:51.576863 IP 165.227.43.194.22 > 198.96.85.21.50318: Flags [P.], seq 737604:737816, ack 433, win 309, options [nop,nop,TS val 2519027644 ecr 440343596], length 212
16:46:51.578310 IP 198.96.85.21.50318 > 165.227.43.194.22: Flags [.], ack 727020, win 2165, options [nop,nop,TS val 440343596 ecr 2519027615], length 0
16:46:51.578336 IP 165.227.43.194.22 > 198.96.85.21.50318: Flags [P.], seq 737816:738028, ack 433, win 309, options [nop,nop,TS val 2519027645 ecr 440343596], length 212
16:46:51.578353 IP 198.96.85.21.50318 > 165.227.43.194.22: Flags [.], ack 727020, win 2254, options [nop,nop,TS val 440343596 ecr 2519027615], length 0
16:46:51.606027 IP 198.96.85.21.50318 > 165.227.43.194.22: Flags [.], ack 727232, win 2250, options [nop,nop,TS val 440343622 ecr 2519027629], length 0
16:46:51.606103 IP 165.227.43.194.22 > 198.96.85.21.50318: Flags [P.], seq 738028:738544, ack 433, win 309, options [nop,nop,TS val 2519027673 ecr 440343622], length 516
16:46:51.606131 IP 198.96.85.21.50318 > 165.227.43.194.22: Flags [.], ack 727900, win 2240, options [nop,nop,TS val 440343622 ecr 2519027629], length 0
16:46:51.606141 IP 198.96.85.21.50318 > 165.227.43.194.22: Flags [.], ack 728112, win 2236, options [nop,nop,TS val 440343622 ecr 2519027629], length 0
16:46:51.606435 IP 165.227.43.194.22 > 198.96.85.21.50318: Flags [P.], seq 738544:739212, ack 433, win 309, options [nop,nop,TS val 2519027673 ecr 440343622], length 668
16:46:51.606549 IP 165.227.43.194.22 > 198.96.85.21.50318: Flags [P.], seq 739212:739424, ack 433, win 309, options [nop,nop,TS val 2519027673 ecr 440343622], length 212
16:46:51.606656 IP 165.227.43.194.22 > 198.96.85.21.50318: Flags [P.], seq 739424:739636, ack 433, win 309, options [nop,nop,TS val 2519027673 ecr 440343622], length 212
16:46:51.612599 IP 198.96.85.21.50318 > 165.227.43.194.22: Flags [.], ack 728324, win 2250, options [nop,nop,TS val 440343622 ecr 2519027639], length 0
16:46:51.612632 IP 165.227.43.194.22 > 198.96.85.21.50318: Flags [P.], seq 739636:739848, ack 433, win 309, options [nop,nop,TS val 2519027679 ecr 440343622], length 212
16:46:51.612653 IP 198.96.85.21.50318 > 165.227.43.194.22: Flags [.], ack 729760, win 2228, options [nop,nop,TS val 440343622 ecr 2519027640], length 0
16:46:51.612663 IP 198.96.85.21.50318 > 165.227.43.194.22: Flags [.], ack 729972, win 2224, options [nop,nop,TS val 440343622 ecr 2519027640], length 0
16:46:51.612669 IP 198.96.85.21.50318 > 165.227.43.194.22: Flags [.], ack 730184, win 2250, options [nop,nop,TS val 440343622 ecr 2519027640], length 0
16:46:51.612676 IP 198.96.85.21.50318 > 165.227.43.194.22: Flags [.], ack 730396, win 2247, options [nop,nop,TS val 440343622 ecr 2519027640], length 0
16:46:51.612682 IP 198.96.85.21.50318 > 165.227.43.194.22: Flags [.], ack 730608, win 2244, options [nop,nop,TS val 440343622 ecr 2519027640], length 0