root@lamp-s-1vcpu-1gb-tor1-01:~# tcpdump -i eth0
tcpdump: verbose output suppressed, use -v or -vv for full protocol decode
listening on eth0, link-type EN10MB (Ethernet), capture size 262144 bytes
16:31:35.667327 IP lamp-s-1vcpu-1gb-tor1-01.ssh > 198.96.85.21.40530: Flags [P.], seq 3363856933:3363857041, ack 3324946098, win 309, options [nop,nop,TS val 2518111736 ecr 439434292], length 108
16:31:35.667422 IP lamp-s-1vcpu-1gb-tor1-01.ssh > 198.96.85.21.40530: Flags [P.], seq 108:144, ack 1, win 309, options [nop,nop,TS val 2518111736 ecr 439434292], length 36
16:31:35.667522 IP lamp-s-1vcpu-1gb-tor1-01.ssh > 198.96.85.21.40530: Flags [P.], seq 144:252, ack 1, win 309, options [nop,nop,TS val 2518111736 ecr 439434292], length 108
16:31:35.667578 IP lamp-s-1vcpu-1gb-tor1-01.ssh > 198.96.85.21.40530: Flags [P.], seq 252:288, ack 1, win 309, options [nop,nop,TS val 2518111736 ecr 439434292], length 36
16:31:35.671494 IP lamp-s-1vcpu-1gb-tor1-01.45419 > 67.207.67.2.domain: 22667+ [1au] PTR? 21.85.96.198.in-addr.arpa. (54)
16:31:35.672660 IP 67.207.67.2.domain > lamp-s-1vcpu-1gb-tor1-01.45419: 22667 NXDomain 0/1/1 (119)
16:31:35.673418 IP lamp-s-1vcpu-1gb-tor1-01.45419 > 67.207.67.2.domain: 22667+ PTR? 21.85.96.198.in-addr.arpa. (43)
16:31:35.706086 IP lamp-s-1vcpu-1gb-tor1-01.ssh > 198.96.85.21.40530: Flags [P.], seq 560:772, ack 1, win 309, options [nop,nop,TS val 2518111774 ecr 439434292], length 212
16:31:35.706396 IP lamp-s-1vcpu-1gb-tor1-01.ssh > 198.96.85.21.40530: Flags [P.], seq 808:1020, ack 1, win 309, options [nop,nop,TS val 2518111775 ecr 439434292], length 212
16:31:35.707415 IP lamp-s-1vcpu-1gb-tor1-01.53916 > 67.207.67.2.domain: 28541+ [1au] PTR? 2.67.207.67.in-addr.arpa. (53)
16:31:35.708188 IP 67.207.67.2.domain > lamp-s-1vcpu-1gb-tor1-01.53916: 28541 NXDomain 0/1/1 (120)
16:31:35.725602 IP 198.96.85.21.40530 > lamp-s-1vcpu-1gb-tor1-01.ssh: Flags [.], ack 0, win 2047, options [nop,nop,TS val 439434354 ecr 2518111721], length 0
16:31:35.725668 IP lamp-s-1vcpu-1gb-tor1-01.ssh > 198.96.85.21.40530: Flags [P.], seq 1020:2712, ack 1, win 309, options [nop,nop,TS val 2518111794 ecr 439434354], length 1692
16:31:35.725695 IP 198.96.85.21.40530 > lamp-s-1vcpu-1gb-tor1-01.ssh: Flags [.], ack 108, win 2045, options [nop,nop,TS val 439434354 ecr 2518111736], length 0
16:31:35.725903 IP lamp-s-1vcpu-1gb-tor1-01.ssh > 198.96.85.21.40530: Flags [P.], seq 2712:2908, ack 1, win 309, options [nop,nop,TS val 2518111794 ecr 439434354], length 196
16:31:35.725982 IP lamp-s-1vcpu-1gb-tor1-01.ssh > 198.96.85.21.40530: Flags [P.], seq 2908:2944, ack 1, win 309, options [nop,nop,TS val 2518111794 ecr 439434354], length 36
16:31:35.753078 IP 198.96.85.21.40530 > lamp-s-1vcpu-1gb-tor1-01.ssh: Flags [.], ack 144, win 2045, options [nop,nop,TS val 439434354 ecr 2518111736], length 0
16:31:35.753164 IP lamp-s-1vcpu-1gb-tor1-01.ssh > 198.96.85.21.40530: Flags [P.], seq 2944:3920, ack 1, win 309, options [nop,nop,TS val 2518111822 ecr 439434354], length 976
16:31:35.753202 IP 198.96.85.21.40530 > lamp-s-1vcpu-1gb-tor1-01.ssh: Flags [.], ack 252, win 2043, options [nop,nop,TS val 439434354 ecr 2518111736], length 0
16:31:35.753218 IP 198.96.85.21.40530 > lamp-s-1vcpu-1gb-tor1-01.ssh: Flags [.], ack 288, win 2042, options [nop,nop,TS val 439434354 ecr 2518111736], length 0
16:31:35.753228 IP 198.96.85.21.40530 > lamp-s-1vcpu-1gb-tor1-01.ssh: Flags [.], ack 524, win 2044, options [nop,nop,TS val 439434370 ecr 2518111774], length 0
16:31:35.753235 IP 198.96.85.21.40530 > lamp-s-1vcpu-1gb-tor1-01.ssh: Flags [.], ack 560, win 2043, options [nop,nop,TS val 439434370 ecr 2518111774], length 0
16:31:35.753243 IP 198.96.85.21.40530 > lamp-s-1vcpu-1gb-tor1-01.ssh: Flags [.], ack 772, win 2040, options [nop,nop,TS val 439434370 ecr 2518111774], length 0
16:31:35.753750 IP lamp-s-1vcpu-1gb-tor1-01.ssh > 198.96.85.21.40530: Flags [P.], seq 4152:4364, ack 1, win 309, options [nop,nop,TS val 2518111822 ecr 439434370], length 212
16:31:35.753988 IP lamp-s-1vcpu-1gb-tor1-01.ssh > 198.96.85.21.40530: Flags [P.], seq 4400:4596, ack 1, win 309, options [nop,nop,TS val 2518111822 ecr 439434370], length 196
16:31:35.754211 IP lamp-s-1vcpu-1gb-tor1-01.ssh > 198.96.85.21.40530: Flags [P.], seq 4632:4828, ack 1, win 309, options [nop,nop,TS val 2518111823 ecr 439434370], length 196
16:31:35.754403 IP lamp-s-1vcpu-1gb-tor1-01.ssh > 198.96.85.21.40530: Flags [P.], seq 4864:5060, ack 1, win 309, options [nop,nop,TS val 2518111823 ecr 439434370], length 196
16:31:35.754525 IP lamp-s-1vcpu-1gb-tor1-01.ssh > 198.96.85.21.40530: Flags [P.], seq 5096:5292, ack 1, win 309, options [nop,nop,TS val 2518111823 ecr 439434370], length 196
16:31:35.754776 IP lamp-s-1vcpu-1gb-tor1-01.ssh > 198.96.85.21.40530: Flags [P.], seq 5328:5524, ack 1, win 309, options [nop,nop,TS val 2518111823 ecr 439434370], length 196
16:31:35.754915 IP lamp-s-1vcpu-1gb-tor1-01.ssh > 198.96.85.21.40530: Flags [P.], seq 5560:5772, ack 1, win 309, options [nop,nop,TS val 2518111823 ecr 439434370], length 212
16:31:35.755456 IP 198.96.85.21.40530 > lamp-s-1vcpu-1gb-tor1-01.ssh: Flags [.], ack 2712, win 2021, options [nop,nop,TS val 439434376 ecr 2518111794], length 0
16:31:35.755486 IP lamp-s-1vcpu-1gb-tor1-01.ssh > 198.96.85.21.40530: Flags [P.], seq 5772:6268, ack 1, win 309, options [nop,nop,TS val 2518111824 ecr 439434376], length 496
16:31:35.755550 IP lamp-s-1vcpu-1gb-tor1-01.ssh > 198.96.85.21.40530: Flags [P.], seq 6268:7296, ack 1, win 309, options [nop,nop,TS val 2518111824 ecr 439434376], length 1028
16:31:35.755628 IP lamp-s-1vcpu-1gb-tor1-01.ssh > 198.96.85.21.40530: Flags [P.], seq 7296:7492, ack 1, win 309, options [nop,nop,TS val 2518111824 ecr 439434376], length 196
16:31:35.755710 IP lamp-s-1vcpu-1gb-tor1-01.ssh > 198.96.85.21.40530: Flags [P.], seq 7492:7528, ack 1, win 309, options [nop,nop,TS val 2518111824 ecr 439434376], length 36
16:31:35.768938 IP 198.96.85.21.40530 > lamp-s-1vcpu-1gb-tor1-01.ssh: Flags [.], ack 2908, win 2044, options [nop,nop,TS val 439434377 ecr 2518111794], length 0
16:31:35.768991 IP lamp-s-1vcpu-1gb-tor1-01.ssh > 198.96.85.21.40530: Flags [P.], seq 7528:8520, ack 1, win 309, options [nop,nop,TS val 2518111837 ecr 439434377], length 992
16:31:35.769016 IP 198.96.85.21.40530 > lamp-s-1vcpu-1gb-tor1-01.ssh: Flags [.], ack 2944, win 2044, options [nop,nop,TS val 439434377 ecr 2518111794], length 0
16:31:35.769161 IP lamp-s-1vcpu-1gb-tor1-01.ssh > 198.96.85.21.40530: Flags [P.], seq 8520:8716, ack 1, win 309, options [nop,nop,TS val 2518111838 ecr 439434377], length 196
16:31:35.870791 IP lamp-s-1vcpu-1gb-tor1-01.ssh > 198.96.85.21.40530: Flags [P.], seq 8716:9480, ack 1, win 309, options [nop,nop,TS val 2518111939 ecr 439434377], length 764
16:31:35.948320 IP 198.96.85.21.40530 > lamp-s-1vcpu-1gb-tor1-01.ssh: Flags [.], ack 3920, win 2032, options [nop,nop,TS val 439434591 ecr 2518111822], length 0
16:31:35.948386 IP 198.96.85.21.40530 > lamp-s-1vcpu-1gb-tor1-01.ssh: Flags [.], ack 4116, win 2029, options [nop,nop,TS val 439434591 ecr 2518111822], length 0
16:31:35.948411 IP lamp-s-1vcpu-1gb-tor1-01.ssh > 198.96.85.21.40530: Flags [P.], seq 9480:9728, ack 1, win 309, options [nop,nop,TS val 2518112017 ecr 439434591], length 248
16:31:35.961217 IP 198.96.85.21.40530 > lamp-s-1vcpu-1gb-tor1-01.ssh: Flags [.], ack 4152, win 2029, options [nop,nop,TS val 439434591 ecr 2518111822], length 0
16:31:35.961278 IP lamp-s-1vcpu-1gb-tor1-01.ssh > 198.96.85.21.40530: Flags [P.], seq 9728:10440, ack 1, win 309, options [nop,nop,TS val 2518112030 ecr 439434591], length 712
16:31:35.961309 IP 198.96.85.21.40530 > lamp-s-1vcpu-1gb-tor1-01.ssh: Flags [.], ack 4364, win 2025, options [nop,nop,TS val 439434591 ecr 2518111822], length 0
16:31:35.961323 IP 198.96.85.21.40530 > lamp-s-1vcpu-1gb-tor1-01.ssh: Flags [.], ack 4400, win 2025, options [nop,nop,TS val 439434591 ecr 2518111822], length 0
16:31:35.961331 IP 198.96.85.21.40530 > lamp-s-1vcpu-1gb-tor1-01.ssh: Flags [.], ack 4596, win 2022, options [nop,nop,TS val 439434591 ecr 2518111822], length 0
16:31:35.961338 IP 198.96.85.21.40530 > lamp-s-1vcpu-1gb-tor1-01.ssh: Flags [.], ack 4632, win 2021, options [nop,nop,TS val 439434591 ecr 2518111822], length 0
16:31:35.961343 IP 198.96.85.21.40530 > lamp-s-1vcpu-1gb-tor1-01.ssh: Flags [.], ack 4828, win 2018, options [nop,nop,TS val 439434591 ecr 2518111823], length 0
16:31:35.961854 IP lamp-s-1vcpu-1gb-tor1-01.ssh > 198.96.85.21.40530: Flags [P.], seq 10672:10884, ack 1, win 309, options [nop,nop,TS val 2518112030 ecr 439434591], length 212
16:31:35.962130 IP lamp-s-1vcpu-1gb-tor1-01.ssh > 198.96.85.21.40530: Flags [P.], seq 10920:11116, ack 1, win 309, options [nop,nop,TS val 2518112031 ecr 439434591], length 196
16:31:35.962495 IP lamp-s-1vcpu-1gb-tor1-01.ssh > 198.96.85.21.40530: Flags [P.], seq 11152:11348, ack 1, win 309, options [nop,nop,TS val 2518112031 ecr 439434591], length 196
16:31:35.962761 IP lamp-s-1vcpu-1gb-tor1-01.ssh > 198.96.85.21.40530: Flags [P.], seq 11384:11580, ack 1, win 309, options [nop,nop,TS val 2518112031 ecr 439434591], length 196
16:31:35.963009 IP lamp-s-1vcpu-1gb-tor1-01.ssh > 198.96.85.21.40530: Flags [P.], seq 11616:11812, ack 1, win 309, options [nop,nop,TS val 2518112031 ecr 439434591], length 196
16:31:35.963192 IP lamp-s-1vcpu-1gb-tor1-01.ssh > 198.96.85.21.40530: Flags [P.], seq 11812:12192, ack 1, win 309, options [nop,nop,TS val 2518112032 ecr 439434591], length 380
16:31:35.963470 IP lamp-s-1vcpu-1gb-tor1-01.ssh > 198.96.85.21.40530: Flags [P.], seq 12192:13116, ack 1, win 309, options [nop,nop,TS val 2518112032 ecr 439434591], length 924
16:31:35.963645 IP lamp-s-1vcpu-1gb-tor1-01.ssh > 198.96.85.21.40530: Flags [P.], seq 13116:13336, ack 1, win 309, options [nop,nop,TS val 2518112032 ecr 439434591], length 220
16:31:35.963766 IP lamp-s-1vcpu-1gb-tor1-01.ssh > 198.96.85.21.40530: Flags [P.], seq 13336:13548, ack 1, win 309, options [nop,nop,TS val 2518112032 ecr 439434591], length 212
16:31:35.963881 IP lamp-s-1vcpu-1gb-tor1-01.ssh > 198.96.85.21.40530: Flags [P.], seq 13548:13760, ack 1, win 309, options [nop,nop,TS val 2518112032 ecr 439434591], length 212
16:31:35.963990 IP lamp-s-1vcpu-1gb-tor1-01.ssh > 198.96.85.21.40530: Flags [P.], seq 13760:13972, ack 1, win 309, options [nop,nop,TS val 2518112032 ecr 439434591], length 212
16:31:35.964101 IP lamp-s-1vcpu-1gb-tor1-01.ssh > 198.96.85.21.40530: Flags [P.], seq 13972:14184, ack 1, win 309, options [nop,nop,TS val 2518112032 ecr 439434591], length 212
16:31:35.964295 IP lamp-s-1vcpu-1gb-tor1-01.ssh > 198.96.85.21.40530: Flags [P.], seq 14184:14396, ack 1, win 309, options [nop,nop,TS val 2518112033 ecr 439434591], length 212
16:31:35.964537 IP lamp-s-1vcpu-1gb-tor1-01.ssh > 198.96.85.21.40530: Flags [P.], seq 14396:14608, ack 1, win 309, options [nop,nop,TS val 2518112033 ecr 439434591], length 212
16:31:35.964728 IP lamp-s-1vcpu-1gb-tor1-01.ssh > 198.96.85.21.40530: Flags [P.], seq 14608:14820, ack 1, win 309, options [nop,nop,TS val 2518112033 ecr 439434591], length 212
16:31:35.984696 IP 198.96.85.21.40530 > lamp-s-1vcpu-1gb-tor1-01.ssh: Flags [.], ack 9728, win 2044, options [nop,nop,TS val 439434627 ecr 2518112017], length 0
16:31:35.984781 IP lamp-s-1vcpu-1gb-tor1-01.ssh > 198.96.85.21.40530: Flags [P.], seq 14820:15032, ack 1, win 309, options [nop,nop,TS val 2518112053 ecr 439434627], length 212
16:31:35.984820 IP 198.96.85.21.40530 > lamp-s-1vcpu-1gb-tor1-01.ssh: Flags [.], ack 10440, win 2033, options [nop,nop,TS val 439434627 ecr 2518112030], length 0
16:31:35.985205 IP lamp-s-1vcpu-1gb-tor1-01.ssh > 198.96.85.21.40530: Flags [P.], seq 15032:15572, ack 1, win 309, options [nop,nop,TS val 2518112054 ecr 439434627], length 540
16:31:36.003688 IP 198.96.85.21.40530 > lamp-s-1vcpu-1gb-tor1-01.ssh: Flags [.], ack 10636, win 2029, options [nop,nop,TS val 439434627 ecr 2518112030], length 0
16:31:36.003769 IP lamp-s-1vcpu-1gb-tor1-01.ssh > 198.96.85.21.40530: Flags [P.], seq 15572:15784, ack 1, win 309, options [nop,nop,TS val 2518112072 ecr 439434627], length 212
16:31:36.003807 IP 198.96.85.21.40530 > lamp-s-1vcpu-1gb-tor1-01.ssh: Flags [.], ack 10672, win 2029, options [nop,nop,TS val 439434627 ecr 2518112030], length 0
16:31:36.003824 IP 198.96.85.21.40530 > lamp-s-1vcpu-1gb-tor1-01.ssh: Flags [.], ack 10884, win 2044, options [nop,nop,TS val 439434627 ecr 2518112030], length 0
16:31:36.003835 IP 198.96.85.21.40530 > lamp-s-1vcpu-1gb-tor1-01.ssh: Flags [.], ack 10920, win 2044, options [nop,nop,TS val 439434627 ecr 2518112030], length 0
16:31:36.003844 IP 198.96.85.21.40530 > lamp-s-1vcpu-1gb-tor1-01.ssh: Flags [.], ack 11116, win 2041, options [nop,nop,TS val 439434627 ecr 2518112031], length 0
16:31:36.003854 IP 198.96.85.21.40530 > lamp-s-1vcpu-1gb-tor1-01.ssh: Flags [.], ack 11152, win 2040, options [nop,nop,TS val 439434627 ecr 2518112031], length 0
16:31:36.004404 IP lamp-s-1vcpu-1gb-tor1-01.ssh > 198.96.85.21.40530: Flags [P.], seq 15784:16980, ack 1, win 309, options [nop,nop,TS val 2518112073 ecr 439434627], length 1196
16:31:36.004613 IP lamp-s-1vcpu-1gb-tor1-01.ssh > 198.96.85.21.40530: Flags [P.], seq 16980:17200, ack 1, win 309, options [nop,nop,TS val 2518112073 ecr 439434627], length 220
16:31:36.004845 IP lamp-s-1vcpu-1gb-tor1-01.ssh > 198.96.85.21.40530: Flags [P.], seq 17200:17412, ack 1, win 309, options [nop,nop,TS val 2518112073 ecr 439434627], length 212
16:31:36.005123 IP lamp-s-1vcpu-1gb-tor1-01.ssh > 198.96.85.21.40530: Flags [P.], seq 17412:17624, ack 1, win 309, options [nop,nop,TS val 2518112073 ecr 439434627], length 212
16:31:36.005326 IP lamp-s-1vcpu-1gb-tor1-01.ssh > 198.96.85.21.40530: Flags [P.], seq 17624:17836, ack 1, win 309, options [nop,nop,TS val 2518112074 ecr 439434627], length 212
16:31:36.005530 IP lamp-s-1vcpu-1gb-tor1-01.ssh > 198.96.85.21.40530: Flags [P.], seq 17836:18048, ack 1, win 309, options [nop,nop,TS val 2518112074 ecr 439434627], length 212
16:31:36.005713 IP lamp-s-1vcpu-1gb-tor1-01.ssh > 198.96.85.21.40530: Flags [P.], seq 18048:18260, ack 1, win 309, options [nop,nop,TS val 2518112074 ecr 439434627], length 212
16:31:36.005966 IP lamp-s-1vcpu-1gb-tor1-01.ssh > 198.96.85.21.40530: Flags [P.], seq 18260:18472, ack 1, win 309, options [nop,nop,TS val 2518112074 ecr 439434627], length 212
16:31:36.006166 IP lamp-s-1vcpu-1gb-tor1-01.ssh > 198.96.85.21.40530: Flags [P.], seq 18472:18684, ack 1, win 309, options [nop,nop,TS val 2518112075 ecr 439434627], length 212
16:31:36.006391 IP lamp-s-1vcpu-1gb-tor1-01.ssh > 198.96.85.21.40530: Flags [P.], seq 18684:18896, ack 1, win 309, options [nop,nop,TS val 2518112075 ecr 439434627], length 212
16:31:36.017341 IP 198.96.85.21.40530 > lamp-s-1vcpu-1gb-tor1-01.ssh: Flags [.], ack 12192, win 2042, options [nop,nop,TS val 439434643 ecr 2518112032], length 0
16:31:36.017398 IP lamp-s-1vcpu-1gb-tor1-01.ssh > 198.96.85.21.40530: Flags [P.], seq 18896:19108, ack 1, win 309, options [nop,nop,TS val 2518112086 ecr 439434643], length 212
16:31:36.017423 IP 198.96.85.21.40530 > lamp-s-1vcpu-1gb-tor1-01.ssh: Flags [.], ack 13116, win 2027, options [nop,nop,TS val 439434643 ecr 2518112032], length 0
16:31:36.017432 IP 198.96.85.21.40530 > lamp-s-1vcpu-1gb-tor1-01.ssh: Flags [.], ack 13336, win 2024, options [nop,nop,TS val 439434643 ecr 2518112032], length 0
16:31:36.017441 IP 198.96.85.21.40530 > lamp-s-1vcpu-1gb-tor1-01.ssh: Flags [.], ack 13548, win 2020, options [nop,nop,TS val 439434643 ecr 2518112032], length 0
16:31:36.017447 IP 198.96.85.21.40530 > lamp-s-1vcpu-1gb-tor1-01.ssh: Flags [.], ack 13760, win 2023, options [nop,nop,TS val 439434643 ecr 2518112032], length 0
16:31:36.017453 IP 198.96.85.21.40530 > lamp-s-1vcpu-1gb-tor1-01.ssh: Flags [.], ack 13972, win 2044, options [nop,nop,TS val 439434643 ecr 2518112032], length 0
16:31:36.017797 IP lamp-s-1vcpu-1gb-tor1-01.ssh > 198.96.85.21.40530: Flags [P.], seq 19108:20304, ack 1, win 309, options [nop,nop,TS val 2518112086 ecr 439434643], length 1196
16:31:36.017909 IP lamp-s-1vcpu-1gb-tor1-01.ssh > 198.96.85.21.40530: Flags [P.], seq 20304:20524, ack 1, win 309, options [nop,nop,TS val 2518112086 ecr 439434643], length 220
16:31:36.018006 IP lamp-s-1vcpu-1gb-tor1-01.ssh > 198.96.85.21.40530: Flags [P.], seq 20524:20736, ack 1, win 309, options [nop,nop,TS val 2518112086 ecr 439434643], length 212
16:31:36.018097 IP lamp-s-1vcpu-1gb-tor1-01.ssh > 198.96.85.21.40530: Flags [P.], seq 20736:20948, ack 1, win 309, options [nop,nop,TS val 2518112086 ecr 439434643], length 212
16:31:36.018187 IP lamp-s-1vcpu-1gb-tor1-01.ssh > 198.96.85.21.40530: Flags [P.], seq 20948:21160, ack 1, win 309, options [nop,nop,TS val 2518112087 ecr 439434643], length 212
16:31:36.018280 IP lamp-s-1vcpu-1gb-tor1-01.ssh > 198.96.85.21.40530: Flags [P.], seq 21160:21372, ack 1, win 309, options [nop,nop,TS val 2518112087 ecr 439434643], length 212
16:31:36.018373 IP lamp-s-1vcpu-1gb-tor1-01.ssh > 198.96.85.21.40530: Flags [P.], seq 21372:21584, ack 1, win 309, options [nop,nop,TS val 2518112087 ecr 439434643], length 212
16:31:36.018466 IP lamp-s-1vcpu-1gb-tor1-01.ssh > 198.96.85.21.40530: Flags [P.], seq 21584:21796, ack 1, win 309, options [nop,nop,TS val 2518112087 ecr 439434643], length 212
16:31:36.018558 IP lamp-s-1vcpu-1gb-tor1-01.ssh > 198.96.85.21.40530: Flags [P.], seq 21796:22008, ack 1, win 309, options [nop,nop,TS val 2518112087 ecr 439434643], length 212
16:31:36.018651 IP lamp-s-1vcpu-1gb-tor1-01.ssh > 198.96.85.21.40530: Flags [P.], seq 22008:22220, ack 1, win 309, options [nop,nop,TS val 2518112087 ecr 439434643], length 212
16:31:36.018806 IP lamp-s-1vcpu-1gb-tor1-01.ssh > 198.96.85.21.40530: Flags [P.], seq 22220:22432, ack 1, win 309, options [nop,nop,TS val 2518112087 ecr 439434643], length 212
16:31:36.018909 IP lamp-s-1vcpu-1gb-tor1-01.ssh > 198.96.85.21.40530: Flags [P.], seq 22432:22644, ack 1, win 309, options [nop,nop,TS val 2518112087 ecr 439434643], length 212
16:31:36.064331 IP 198.96.85.21.40530 > lamp-s-1vcpu-1gb-tor1-01.ssh: Flags [.], ack 15784, win 2044, options [nop,nop,TS val 439434670 ecr 2518112072], length 0
16:31:36.064409 IP lamp-s-1vcpu-1gb-tor1-01.ssh > 198.96.85.21.40530: Flags [P.], seq 22644:22856, ack 1, win 309, options [nop,nop,TS val 2518112133 ecr 439434670], length 212
16:31:36.064438 IP 198.96.85.21.40530 > lamp-s-1vcpu-1gb-tor1-01.ssh: Flags [.], ack 16980, win 2029, options [nop,nop,TS val 439434683 ecr 2518112073], length 0
16:31:36.064722 IP lamp-s-1vcpu-1gb-tor1-01.ssh > 198.96.85.21.40530: Flags [P.], seq 22856:23396, ack 1, win 309, options [nop,nop,TS val 2518112133 ecr 439434683], length 540
16:31:36.075817 IP 198.96.85.21.40530 > lamp-s-1vcpu-1gb-tor1-01.ssh: Flags [.], ack 17200, win 2025, options [nop,nop,TS val 439434683 ecr 2518112073], length 0
16:31:36.075876 IP lamp-s-1vcpu-1gb-tor1-01.ssh > 198.96.85.21.40530: Flags [P.], seq 23396:23608, ack 1, win 309, options [nop,nop,TS val 2518112144 ecr 439434683], length 212
16:31:36.075901 IP 198.96.85.21.40530 > lamp-s-1vcpu-1gb-tor1-01.ssh: Flags [.], ack 17412, win 2022, options [nop,nop,TS val 439434683 ecr 2518112073], length 0
16:31:36.075911 IP 198.96.85.21.40530 > lamp-s-1vcpu-1gb-tor1-01.ssh: Flags [.], ack 17624, win 2019, options [nop,nop,TS val 439434683 ecr 2518112073], length 0
16:31:36.075918 IP 198.96.85.21.40530 > lamp-s-1vcpu-1gb-tor1-01.ssh: Flags [.], ack 17836, win 2015, options [nop,nop,TS val 439434683 ecr 2518112074], length 0
16:31:36.075924 IP 198.96.85.21.40530 > lamp-s-1vcpu-1gb-tor1-01.ssh: Flags [.], ack 18048, win 2044, options [nop,nop,TS val 439434709 ecr 2518112074], length 0
16:31:36.075929 IP 198.96.85.21.40530 > lamp-s-1vcpu-1gb-tor1-01.ssh: Flags [.], ack 18260, win 2041, options [nop,nop,TS val 439434709 ecr 2518112074], length 0
16:31:36.076329 IP lamp-s-1vcpu-1gb-tor1-01.ssh > 198.96.85.21.40530: Flags [P.], seq 23608:24804, ack 1, win 309, options [nop,nop,TS val 2518112145 ecr 439434709], length 1196
16:31:36.076435 IP lamp-s-1vcpu-1gb-tor1-01.ssh > 198.96.85.21.40530: Flags [P.], seq 24804:25024, ack 1, win 309, options [nop,nop,TS val 2518112145 ecr 439434709], length 220
16:31:36.076532 IP lamp-s-1vcpu-1gb-tor1-01.ssh > 198.96.85.21.40530: Flags [P.], seq 25024:25236, ack 1, win 309, options [nop,nop,TS val 2518112145 ecr 439434709], length 212
16:31:36.076627 IP lamp-s-1vcpu-1gb-tor1-01.ssh > 198.96.85.21.40530: Flags [P.], seq 25236:25448, ack 1, win 309, options [nop,nop,TS val 2518112145 ecr 439434709], length 212
16:31:36.076722 IP lamp-s-1vcpu-1gb-tor1-01.ssh > 198.96.85.21.40530: Flags [P.], seq 25448:25660, ack 1, win 309, options [nop,nop,TS val 2518112145 ecr 439434709], length 212
16:31:36.076816 IP lamp-s-1vcpu-1gb-tor1-01.ssh > 198.96.85.21.40530: Flags [P.], seq 25660:25872, ack 1, win 309, options [nop,nop,TS val 2518112145 ecr 439434709], length 212
16:31:36.076921 IP lamp-s-1vcpu-1gb-tor1-01.ssh > 198.96.85.21.40530: Flags [P.], seq 25872:26084, ack 1, win 309, options [nop,nop,TS val 2518112145 ecr 439434709], length 212
16:31:36.077012 IP lamp-s-1vcpu-1gb-tor1-01.ssh > 198.96.85.21.40530: Flags [P.], seq 26084:26296, ack 1, win 309, options [nop,nop,TS val 2518112145 ecr 439434709], length 212
16:31:36.077105 IP lamp-s-1vcpu-1gb-tor1-01.ssh > 198.96.85.21.40530: Flags [P.], seq 26296:26508, ack 1, win 309, options [nop,nop,TS val 2518112145 ecr 439434709], length 212
16:31:36.077195 IP lamp-s-1vcpu-1gb-tor1-01.ssh > 198.96.85.21.40530: Flags [P.], seq 26508:26720, ack 1, win 309, options [nop,nop,TS val 2518112146 ecr 439434709], length 212
16:31:36.077284 IP lamp-s-1vcpu-1gb-tor1-01.ssh > 198.96.85.21.40530: Flags [P.], seq 26720:26932, ack 1, win 309, options [nop,nop,TS val 2518112146 ecr 439434709], length 212
16:31:36.077373 IP lamp-s-1vcpu-1gb-tor1-01.ssh > 198.96.85.21.40530: Flags [P.], seq 26932:27144, ack 1, win 309, options [nop,nop,TS val 2518112146 ecr 439434709], length 212
16:31:36.077468 IP lamp-s-1vcpu-1gb-tor1-01.ssh > 198.96.85.21.40530: Flags [P.], seq 27144:27356, ack 1, win 309, options [nop,nop,TS val 2518112146 ecr 439434709], length 212
16:31:36.077559 IP lamp-s-1vcpu-1gb-tor1-01.ssh > 198.96.85.21.40530: Flags [P.], seq 27356:27568, ack 1, win 309, options [nop,nop,TS val 2518112146 ecr 439434709], length 212
16:31:36.077655 IP lamp-s-1vcpu-1gb-tor1-01.ssh > 198.96.85.21.40530: Flags [P.], seq 27568:27780, ack 1, win 309, options [nop,nop,TS val 2518112146 ecr 439434709], length 212
16:31:36.077747 IP lamp-s-1vcpu-1gb-tor1-01.ssh > 198.96.85.21.40530: Flags [P.], seq 27780:27992, ack 1, win 309, options [nop,nop,TS val 2518112146 ecr 439434709], length 212
16:31:36.077840 IP lamp-s-1vcpu-1gb-tor1-01.ssh > 198.96.85.21.40530: Flags [P.], seq 27992:28204, ack 1, win 309, options [nop,nop,TS val 2518112146 ecr 439434709], length 212
16:31:36.077932 IP lamp-s-1vcpu-1gb-tor1-01.ssh > 198.96.85.21.40530: Flags [P.], seq 28204:28416, ack 1, win 309, options [nop,nop,TS val 2518112146 ecr 439434709], length 212
16:31:36.137191 IP 198.96.85.21.40530 > lamp-s-1vcpu-1gb-tor1-01.ssh: Flags [.], ack 22008, win 2044, options [nop,nop,TS val 439434768 ecr 2518112087], length 0
16:31:36.137279 IP lamp-s-1vcpu-1gb-tor1-01.ssh > 198.96.85.21.40530: Flags [P.], seq 28416:28628, ack 1, win 309, options [nop,nop,TS val 2518112206 ecr 439434768], length 212
16:31:36.137305 IP 198.96.85.21.40530 > lamp-s-1vcpu-1gb-tor1-01.ssh: Flags [.], ack 22220, win 2041, options [nop,nop,TS val 439434768 ecr 2518112087], length 0
16:31:36.137586 IP lamp-s-1vcpu-1gb-tor1-01.ssh > 198.96.85.21.40530: Flags [P.], seq 28628:29168, ack 1, win 309, options [nop,nop,TS val 2518112206 ecr 439434768], length 540
16:31:36.137980 IP 198.96.85.21.40530 > lamp-s-1vcpu-1gb-tor1-01.ssh: Flags [.], ack 22432, win 2038, options [nop,nop,TS val 439434768 ecr 2518112087], length 0
16:31:36.138005 IP lamp-s-1vcpu-1gb-tor1-01.ssh > 198.96.85.21.40530: Flags [P.], seq 29168:29380, ack 1, win 309, options [nop,nop,TS val 2518112206 ecr 439434768], length 212
16:31:36.138024 IP 198.96.85.21.40530 > lamp-s-1vcpu-1gb-tor1-01.ssh: Flags [.], ack 22644, win 2034, options [nop,nop,TS val 439434768 ecr 2518112087], length 0
16:31:36.138130 IP 198.96.85.21.40530 > lamp-s-1vcpu-1gb-tor1-01.ssh: Flags [.], ack 22856, win 2031, options [nop,nop,TS val 439434768 ecr 2518112133], length 0
16:31:36.138144 IP 198.96.85.21.40530 > lamp-s-1vcpu-1gb-tor1-01.ssh: Flags [.], ack 23396, win 2039, options [nop,nop,TS val 439434768 ecr 2518112133], length 0
16:31:36.138150 IP 198.96.85.21.40530 > lamp-s-1vcpu-1gb-tor1-01.ssh: Flags [.], ack 23608, win 2036, options [nop,nop,TS val 439434768 ecr 2518112144], length 0
16:31:36.138156 IP 198.96.85.21.40530 > lamp-s-1vcpu-1gb-tor1-01.ssh: Flags [.], ack 24804, win 2017, options [nop,nop,TS val 439434768 ecr 2518112145], length 0
16:31:36.138162 IP 198.96.85.21.40530 > lamp-s-1vcpu-1gb-tor1-01.ssh: Flags [.], ack 25024, win 2014, options [nop,nop,TS val 439434768 ecr 2518112145], length 0
16:31:36.138167 IP 198.96.85.21.40530 > lamp-s-1vcpu-1gb-tor1-01.ssh: Flags [.], ack 25236, win 2010, options [nop,nop,TS val 439434768 ecr 2518112145], length 0
16:31:36.138212 IP 198.96.85.21.40530 > lamp-s-1vcpu-1gb-tor1-01.ssh: Flags [.], ack 25872, win 2000, options [nop,nop,TS val 439434768 ecr 2518112145], length 0
16:31:36.138510 IP lamp-s-1vcpu-1gb-tor1-01.ssh > 198.96.85.21.40530: Flags [P.], seq 29380:31064, ack 1, win 309, options [nop,nop,TS val 2518112207 ecr 439434768], length 1684
16:31:36.138619 IP lamp-s-1vcpu-1gb-tor1-01.ssh > 198.96.85.21.40530: Flags [P.], seq 31064:31284, ack 1, win 309, options [nop,nop,TS val 2518112207 ecr 439434768], length 220
16:31:36.138740 IP lamp-s-1vcpu-1gb-tor1-01.ssh > 198.96.85.21.40530: Flags [P.], seq 31284:31496, ack 1, win 309, options [nop,nop,TS val 2518112207 ecr 439434768], length 212
16:31:36.138833 IP lamp-s-1vcpu-1gb-tor1-01.ssh > 198.96.85.21.40530: Flags [P.], seq 31496:31708, ack 1, win 309, options [nop,nop,TS val 2518112207 ecr 439434768], length 212
16:31:36.138927 IP lamp-s-1vcpu-1gb-tor1-01.ssh > 198.96.85.21.40530: Flags [P.], seq 31708:31920, ack 1, win 309, options [nop,nop,TS val 2518112207 ecr 439434768], length 212
16:31:36.139020 IP lamp-s-1vcpu-1gb-tor1-01.ssh > 198.96.85.21.40530: Flags [P.], seq 31920:32132, ack 1, win 309, options [nop,nop,TS val 2518112207 ecr 439434768], length 212
16:31:36.139113 IP lamp-s-1vcpu-1gb-tor1-01.ssh > 198.96.85.21.40530: Flags [P.], seq 32132:32344, ack 1, win 309, options [nop,nop,TS val 2518112207 ecr 439434768], length 212
16:31:36.139210 IP lamp-s-1vcpu-1gb-tor1-01.ssh > 198.96.85.21.40530: Flags [P.], seq 32344:32556, ack 1, win 309, options [nop,nop,TS val 2518112208 ecr 439434768], length 212
16:31:36.139303 IP lamp-s-1vcpu-1gb-tor1-01.ssh > 198.96.85.21.40530: Flags [P.], seq 32556:32768, ack 1, win 309, options [nop,nop,TS val 2518112208 ecr 439434768], length 212
16:31:36.139424 IP lamp-s-1vcpu-1gb-tor1-01.ssh > 198.96.85.21.40530: Flags [P.], seq 32768:32980, ack 1, win 309, options [nop,nop,TS val 2518112208 ecr 439434768], length 212
16:31:36.139527 IP lamp-s-1vcpu-1gb-tor1-01.ssh > 198.96.85.21.40530: Flags [P.], seq 32980:33192, ack 1, win 309, options [nop,nop,TS val 2518112208 ecr 439434768], length 212
16:31:36.139624 IP lamp-s-1vcpu-1gb-tor1-01.ssh > 198.96.85.21.40530: Flags [P.], seq 33192:33404, ack 1, win 309, options [nop,nop,TS val 2518112208 ecr 439434768], length 212
16:31:36.139722 IP lamp-s-1vcpu-1gb-tor1-01.ssh > 198.96.85.21.40530: Flags [P.], seq 33404:33616, ack 1, win 309, options [nop,nop,TS val 2518112208 ecr 439434768], length 212
16:31:36.139818 IP lamp-s-1vcpu-1gb-tor1-01.ssh > 198.96.85.21.40530: Flags [P.], seq 33616:33828, ack 1, win 309, options [nop,nop,TS val 2518112208 ecr 439434768], length 212
16:31:36.139908 IP lamp-s-1vcpu-1gb-tor1-01.ssh > 198.96.85.21.40530: Flags [P.], seq 33828:34040, ack 1, win 309, options [nop,nop,TS val 2518112208 ecr 439434768], length 212
16:31:36.140004 IP lamp-s-1vcpu-1gb-tor1-01.ssh > 198.96.85.21.40530: Flags [P.], seq 34040:34252, ack 1, win 309, options [nop,nop,TS val 2518112208 ecr 439434768], length 212
16:31:36.140097 IP lamp-s-1vcpu-1gb-tor1-01.ssh > 198.96.85.21.40530: Flags [P.], seq 34252:34464, ack 1, win 309, options [nop,nop,TS val 2518112208 ecr 439434768], length 212
16:31:36.140191 IP lamp-s-1vcpu-1gb-tor1-01.ssh > 198.96.85.21.40530: Flags [P.], seq 34464:34676, ack 1, win 309, options [nop,nop,TS val 2518112209 ecr 439434768], length 212
16:31:36.140284 IP lamp-s-1vcpu-1gb-tor1-01.ssh > 198.96.85.21.40530: Flags [P.], seq 34676:34888, ack 1, win 309, options [nop,nop,TS val 2518112209 ecr 439434768], length 212
16:31:36.140379 IP lamp-s-1vcpu-1gb-tor1-01.ssh > 198.96.85.21.40530: Flags [P.], seq 34888:35100, ack 1, win 309, options [nop,nop,TS val 2518112209 ecr 439434768], length 212
16:31:36.140473 IP lamp-s-1vcpu-1gb-tor1-01.ssh > 198.96.85.21.40530: Flags [P.], seq 35100:35312, ack 1, win 309, options [nop,nop,TS val 2518112209 ecr 439434768], length 212
16:31:36.140569 IP lamp-s-1vcpu-1gb-tor1-01.ssh > 198.96.85.21.40530: Flags [P.], seq 35312:35524, ack 1, win 309, options [nop,nop,TS val 2518112209 ecr 439434768], length 212
16:31:36.147933 IP 198.96.85.21.40530 > lamp-s-1vcpu-1gb-tor1-01.ssh: Flags [.], ack 28628, win 2044, options [nop,nop,TS val 439434785 ecr 2518112206], length 0
16:31:36.147974 IP lamp-s-1vcpu-1gb-tor1-01.ssh > 198.96.85.21.40530: Flags [P.], seq 35524:35736, ack 1, win 309, options [nop,nop,TS val 2518112216 ecr 439434785], length 212
16:31:36.147998 IP 198.96.85.21.40530 > lamp-s-1vcpu-1gb-tor1-01.ssh: Flags [.], ack 29168, win 2036, options [nop,nop,TS val 439434785 ecr 2518112206], length 0
16:31:36.148199 IP lamp-s-1vcpu-1gb-tor1-01.ssh > 198.96.85.21.40530: Flags [P.], seq 35736:36276, ack 1, win 309, options [nop,nop,TS val 2518112217 ecr 439434785], length 540
16:31:36.160400 IP 198.96.85.21.40530 > lamp-s-1vcpu-1gb-tor1-01.ssh: Flags [.], ack 29380, win 2032, options [nop,nop,TS val 439434785 ecr 2518112206], length 0
16:31:36.160483 IP lamp-s-1vcpu-1gb-tor1-01.ssh > 198.96.85.21.40530: Flags [P.], seq 36276:36488, ack 1, win 309, options [nop,nop,TS val 2518112229 ecr 439434785], length 212
16:31:36.160533 IP 198.96.85.21.40530 > lamp-s-1vcpu-1gb-tor1-01.ssh: Flags [.], ack 31064, win 2006, options [nop,nop,TS val 439434785 ecr 2518112207], length 0
16:31:36.160561 IP 198.96.85.21.40530 > lamp-s-1vcpu-1gb-tor1-01.ssh: Flags [.], ack 31284, win 2003, options [nop,nop,TS val 439434785 ecr 2518112207], length 0
16:31:36.160577 IP 198.96.85.21.40530 > lamp-s-1vcpu-1gb-tor1-01.ssh: Flags [.], ack 31496, win 1999, options [nop,nop,TS val 439434785 ecr 2518112207], length 0
16:31:36.160589 IP 198.96.85.21.40530 > lamp-s-1vcpu-1gb-tor1-01.ssh: Flags [.], ack 31708, win 1996, options [nop,nop,TS val 439434785 ecr 2518112207], length 0
16:31:36.160599 IP 198.96.85.21.40530 > lamp-s-1vcpu-1gb-tor1-01.ssh: Flags [.], ack 31920, win 2008, options [nop,nop,TS val 439434785 ecr 2518112207], length 0
16:31:36.161293 IP lamp-s-1vcpu-1gb-tor1-01.ssh > 198.96.85.21.40530: Flags [P.], seq 36488:37684, ack 1, win 309, options [nop,nop,TS val 2518112230 ecr 439434785], length 1196
16:31:36.161567 IP lamp-s-1vcpu-1gb-tor1-01.ssh > 198.96.85.21.40530: Flags [P.], seq 37684:37904, ack 1, win 309, options [nop,nop,TS val 2518112230 ecr 439434785], length 220
16:31:36.161790 IP lamp-s-1vcpu-1gb-tor1-01.ssh > 198.96.85.21.40530: Flags [P.], seq 37904:38116, ack 1, win 309, options [nop,nop,TS val 2518112230 ecr 439434785], length 212
16:31:36.162065 IP lamp-s-1vcpu-1gb-tor1-01.ssh > 198.96.85.21.40530: Flags [P.], seq 38116:38328, ack 1, win 309, options [nop,nop,TS val 2518112230 ecr 439434785], length 212
16:31:36.162283 IP lamp-s-1vcpu-1gb-tor1-01.ssh > 198.96.85.21.40530: Flags [P.], seq 38328:38540, ack 1, win 309, options [nop,nop,TS val 2518112231 ecr 439434785], length 212
16:31:36.162460 IP lamp-s-1vcpu-1gb-tor1-01.ssh > 198.96.85.21.40530: Flags [P.], seq 38540:38752, ack 1, win 309, options [nop,nop,TS val 2518112231 ecr 439434785], length 212
16:31:36.162597 IP lamp-s-1vcpu-1gb-tor1-01.ssh > 198.96.85.21.40530: Flags [P.], seq 38752:38964, ack 1, win 309, options [nop,nop,TS val 2518112231 ecr 439434785], length 212
16:31:36.162784 IP lamp-s-1vcpu-1gb-tor1-01.ssh > 198.96.85.21.40530: Flags [P.], seq 38964:39176, ack 1, win 309, options [nop,nop,TS val 2518112231 ecr 439434785], length 212
16:31:36.162945 IP lamp-s-1vcpu-1gb-tor1-01.ssh > 198.96.85.21.40530: Flags [P.], seq 39176:39388, ack 1, win 309, options [nop,nop,TS val 2518112231 ecr 439434785], length 212
16:31:36.163112 IP lamp-s-1vcpu-1gb-tor1-01.ssh > 198.96.85.21.40530: Flags [P.], seq 39388:39600, ack 1, win 309, options [nop,nop,TS val 2518112231 ecr 439434785], length 212
16:31:36.163272 IP lamp-s-1vcpu-1gb-tor1-01.ssh > 198.96.85.21.40530: Flags [P.], seq 39600:39812, ack 1, win 309, options [nop,nop,TS val 2518112232 ecr 439434785], length 212
16:31:36.163468 IP lamp-s-1vcpu-1gb-tor1-01.ssh > 198.96.85.21.40530: Flags [P.], seq 39812:40024, ack 1, win 309, options [nop,nop,TS val 2518112232 ecr 439434785], length 212
16:31:36.163645 IP lamp-s-1vcpu-1gb-tor1-01.ssh > 198.96.85.21.40530: Flags [P.], seq 40024:40236, ack 1, win 309, options [nop,nop,TS val 2518112232 ecr 439434785], length 212
16:31:36.163810 IP lamp-s-1vcpu-1gb-tor1-01.ssh > 198.96.85.21.40530: Flags [P.], seq 40236:40448, ack 1, win 309, options [nop,nop,TS val 2518112232 ecr 439434785], length 212
16:31:36.163974 IP lamp-s-1vcpu-1gb-tor1-01.ssh > 198.96.85.21.40530: Flags [P.], seq 40448:40660, ack 1, win 309, options [nop,nop,TS val 2518112232 ecr 439434785], length 212
16:31:36.185800 IP 198.96.85.21.40530 > lamp-s-1vcpu-1gb-tor1-01.ssh: Flags [.], ack 33828, win 2044, options [nop,nop,TS val 439434824 ecr 2518112208], length 0
16:31:36.185877 IP lamp-s-1vcpu-1gb-tor1-01.ssh > 198.96.85.21.40530: Flags [P.], seq 40660:40872, ack 1, win 309, options [nop,nop,TS val 2518112254 ecr 439434824], length 212
16:31:36.185915 IP 198.96.85.21.40530 > lamp-s-1vcpu-1gb-tor1-01.ssh: Flags [.], ack 34040, win 2041, options [nop,nop,TS val 439434824 ecr 2518112208], length 0
16:31:36.186215 IP lamp-s-1vcpu-1gb-tor1-01.ssh > 198.96.85.21.40530: Flags [P.], seq 40872:41412, ack 1, win 309, options [nop,nop,TS val 2518112255 ecr 439434824], length 540
16:31:36.186322 IP 198.96.85.21.40530 > lamp-s-1vcpu-1gb-tor1-01.ssh: Flags [.], ack 34252, win 2038, options [nop,nop,TS val 439434824 ecr 2518112208], length 0
16:31:36.186344 IP 198.96.85.21.40530 > lamp-s-1vcpu-1gb-tor1-01.ssh: Flags [.], ack 34464, win 2034, options [nop,nop,TS val 439434824 ecr 2518112208], length 0
16:31:36.186498 IP lamp-s-1vcpu-1gb-tor1-01.ssh > 198.96.85.21.40530: Flags [P.], seq 41412:41952, ack 1, win 309, options [nop,nop,TS val 2518112255 ecr 439434824], length 540
16:31:36.186663 IP lamp-s-1vcpu-1gb-tor1-01.ssh > 198.96.85.21.40530: Flags [P.], seq 41952:42164, ack 1, win 309, options [nop,nop,TS val 2518112255 ecr 439434824], length 212
16:31:36.188069 IP 198.96.85.21.40530 > lamp-s-1vcpu-1gb-tor1-01.ssh: Flags [.], ack 34676, win 2031, options [nop,nop,TS val 439434824 ecr 2518112209], length 0
16:31:36.188113 IP lamp-s-1vcpu-1gb-tor1-01.ssh > 198.96.85.21.40530: Flags [P.], seq 42164:42376, ack 1, win 309, options [nop,nop,TS val 2518112256 ecr 439434824], length 212
16:31:36.188145 IP 198.96.85.21.40530 > lamp-s-1vcpu-1gb-tor1-01.ssh: Flags [.], ack 34888, win 2028, options [nop,nop,TS val 439434824 ecr 2518112209], length 0
16:31:36.188161 IP 198.96.85.21.40530 > lamp-s-1vcpu-1gb-tor1-01.ssh: Flags [.], ack 35100, win 2044, options [nop,nop,TS val 439434824 ecr 2518112209], length 0
16:31:36.188172 IP 198.96.85.21.40530 > lamp-s-1vcpu-1gb-tor1-01.ssh: Flags [.], ack 35312, win 2041, options [nop,nop,TS val 439434824 ecr 2518112209], length 0
16:31:36.188181 IP 198.96.85.21.40530 > lamp-s-1vcpu-1gb-tor1-01.ssh: Flags [.], ack 35524, win 2038, options [nop,nop,TS val 439434824 ecr 2518112209], length 0
16:31:36.188595 IP lamp-s-1vcpu-1gb-tor1-01.ssh > 198.96.85.21.40530: Flags [P.], seq 42376:43404, ack 1, win 309, options [nop,nop,TS val 2518112257 ecr 439434824], length 1028
16:31:36.188786 IP lamp-s-1vcpu-1gb-tor1-01.ssh > 198.96.85.21.40530: Flags [P.], seq 43404:43624, ack 1, win 309, options [nop,nop,TS val 2518112257 ecr 439434824], length 220
16:31:36.188989 IP lamp-s-1vcpu-1gb-tor1-01.ssh > 198.96.85.21.40530: Flags [P.], seq 43624:43836, ack 1, win 309, options [nop,nop,TS val 2518112257 ecr 439434824], length 212
16:31:36.189202 IP lamp-s-1vcpu-1gb-tor1-01.ssh > 198.96.85.21.40530: Flags [P.], seq 43836:44048, ack 1, win 309, options [nop,nop,TS val 2518112258 ecr 439434824], length 212
16:31:36.189397 IP lamp-s-1vcpu-1gb-tor1-01.ssh > 198.96.85.21.40530: Flags [P.], seq 44048:44260, ack 1, win 309, options [nop,nop,TS val 2518112258 ecr 439434824], length 212
16:31:36.237705 IP 198.96.85.21.40530 > lamp-s-1vcpu-1gb-tor1-01.ssh: Flags [.], ack 35736, win 2044, options [nop,nop,TS val 439434876 ecr 2518112216], length 0
16:31:36.237802 IP lamp-s-1vcpu-1gb-tor1-01.ssh > 198.96.85.21.40530: Flags [P.], seq 44260:44472, ack 1, win 309, options [nop,nop,TS val 2518112306 ecr 439434876], length 212
16:31:36.237828 IP 198.96.85.21.40530 > lamp-s-1vcpu-1gb-tor1-01.ssh: Flags [.], ack 36276, win 2036, options [nop,nop,TS val 439434876 ecr 2518112217], length 0
16:31:36.238131 IP lamp-s-1vcpu-1gb-tor1-01.ssh > 198.96.85.21.40530: Flags [P.], seq 44472:45012, ack 1, win 309, options [nop,nop,TS val 2518112307 ecr 439434876], length 540
16:31:36.239167 IP 198.96.85.21.40530 > lamp-s-1vcpu-1gb-tor1-01.ssh: Flags [.], ack 36488, win 2032, options [nop,nop,TS val 439434876 ecr 2518112229], length 0
16:31:36.239204 IP lamp-s-1vcpu-1gb-tor1-01.ssh > 198.96.85.21.40530: Flags [P.], seq 45012:45224, ack 1, win 309, options [nop,nop,TS val 2518112308 ecr 439434876], length 212
16:31:36.239224 IP 198.96.85.21.40530 > lamp-s-1vcpu-1gb-tor1-01.ssh: Flags [.], ack 37684, win 2014, options [nop,nop,TS val 439434876 ecr 2518112230], length 0
16:31:36.239236 IP 198.96.85.21.40530 > lamp-s-1vcpu-1gb-tor1-01.ssh: Flags [.], ack 37904, win 2010, options [nop,nop,TS val 439434876 ecr 2518112230], length 0
16:31:36.239431 IP 198.96.85.21.40530 > lamp-s-1vcpu-1gb-tor1-01.ssh: Flags [.], ack 38116, win 2007, options [nop,nop,TS val 439434876 ecr 2518112230], length 0
16:31:36.239449 IP 198.96.85.21.40530 > lamp-s-1vcpu-1gb-tor1-01.ssh: Flags [.], ack 38328, win 2004, options [nop,nop,TS val 439434876 ecr 2518112230], length 0
16:31:36.239455 IP 198.96.85.21.40530 > lamp-s-1vcpu-1gb-tor1-01.ssh: Flags [.], ack 38540, win 2000, options [nop,nop,TS val 439434876 ecr 2518112231], length 0
16:31:36.239461 IP 198.96.85.21.40530 > lamp-s-1vcpu-1gb-tor1-01.ssh: Flags [.], ack 38540, win 2048, options [nop,nop,TS val 439434876 ecr 2518112231], length 0
16:31:36.239466 IP 198.96.85.21.40530 > lamp-s-1vcpu-1gb-tor1-01.ssh: Flags [.], ack 38752, win 2044, options [nop,nop,TS val 439434876 ecr 2518112231], length 0
16:31:36.239472 IP 198.96.85.21.40530 > lamp-s-1vcpu-1gb-tor1-01.ssh: Flags [.], ack 38964, win 2041, options [nop,nop,TS val 439434876 ecr 2518112231], length 0
16:31:36.239477 IP 198.96.85.21.40530 > lamp-s-1vcpu-1gb-tor1-01.ssh: Flags [.], ack 39176, win 2038, options [nop,nop,TS val 439434876 ecr 2518112231], length 0
16:31:36.239833 IP lamp-s-1vcpu-1gb-tor1-01.ssh > 198.96.85.21.40530: Flags [P.], seq 45224:47068, ack 1, win 309, options [nop,nop,TS val 2518112308 ecr 439434876], length 1844
16:31:36.239942 IP lamp-s-1vcpu-1gb-tor1-01.ssh > 198.96.85.21.40530: Flags [P.], seq 47068:47288, ack 1, win 309, options [nop,nop,TS val 2518112308 ecr 439434876], length 220
16:31:36.240063 IP lamp-s-1vcpu-1gb-tor1-01.ssh > 198.96.85.21.40530: Flags [P.], seq 47288:47500, ack 1, win 309, options [nop,nop,TS val 2518112308 ecr 439434876], length 212
